file,line,type,commit,author,date,time,timezone,datetime,depth,length
styles.css,1,css,c756ca08,AHayslip23,9/30/2025,20:29:13,-07:00,2025-09-30T20:29:13-07:00,0,4
styles.css,2,css,edd1e0e7,AHayslip23,10/3/2025,21:56:13,-07:00,2025-10-03T21:56:13-07:00,1,17
styles.css,3,css,7963fcb3,AHayslip23,10/3/2025,22:14:48,-07:00,2025-10-03T22:14:48-07:00,1,16
styles.css,4,css,edd1e0e7,AHayslip23,10/3/2025,21:56:13,-07:00,2025-10-03T21:56:13-07:00,1,18
styles.css,5,css,edd1e0e7,AHayslip23,10/3/2025,21:56:13,-07:00,2025-10-03T21:56:13-07:00,1,24
styles.css,6,css,c756ca08,AHayslip23,9/30/2025,20:29:13,-07:00,2025-09-30T20:29:13-07:00,1,23
styles.css,7,css,c756ca08,AHayslip23,9/30/2025,20:29:13,-07:00,2025-09-30T20:29:13-07:00,0,0
styles.css,8,css,e67fd98d,AHayslip23,10/4/2025,13:16:32,-07:00,2025-10-04T13:16:32-07:00,0,0
styles.css,9,css,3e36360c,AHayslip23,10/14/2025,20:19:13,-07:00,2025-10-14T20:19:13-07:00,0,4
styles.css,10,css,3e36360c,AHayslip23,10/14/2025,20:19:13,-07:00,2025-10-14T20:19:13-07:00,1,31
styles.css,11,css,3e36360c,AHayslip23,10/14/2025,20:19:13,-07:00,2025-10-14T20:19:13-07:00,0,0
styles.css,12,css,3e36360c,AHayslip23,10/14/2025,20:19:13,-07:00,2025-10-14T20:19:13-07:00,0,0
styles.css,13,css,3e36360c,AHayslip23,10/14/2025,20:19:13,-07:00,2025-10-14T20:19:13-07:00,0,4
styles.css,14,css,3e36360c,AHayslip23,10/14/2025,20:19:13,-07:00,2025-10-14T20:19:13-07:00,1,23
styles.css,15,css,3e36360c,AHayslip23,10/14/2025,20:19:13,-07:00,2025-10-14T20:19:13-07:00,1,23
styles.css,16,css,3e36360c,AHayslip23,10/14/2025,20:19:13,-07:00,2025-10-14T20:19:13-07:00,1,16
styles.css,17,css,3e36360c,AHayslip23,10/14/2025,20:19:13,-07:00,2025-10-14T20:19:13-07:00,0,0
styles.css,18,css,3e36360c,AHayslip23,10/14/2025,20:19:13,-07:00,2025-10-14T20:19:13-07:00,0,0
styles.css,19,css,e67fd98d,AHayslip23,10/4/2025,13:16:32,-07:00,2025-10-04T13:16:32-07:00,0,3
styles.css,20,css,99b48cc0,AHayslip23,10/14/2025,20:11:01,-07:00,2025-10-14T20:11:01-07:00,1,37
styles.css,21,css,e67fd98d,AHayslip23,10/4/2025,13:16:32,-07:00,2025-10-04T13:16:32-07:00,1,41
styles.css,22,css,99b48cc0,AHayslip23,10/14/2025,20:11:01,-07:00,2025-10-14T20:11:01-07:00,1,12
styles.css,23,css,e67fd98d,AHayslip23,10/4/2025,13:16:32,-07:00,2025-10-04T13:16:32-07:00,0,0
styles.css,24,css,e67fd98d,AHayslip23,10/4/2025,13:16:32,-07:00,2025-10-04T13:16:32-07:00,0,5
styles.css,25,css,e67fd98d,AHayslip23,10/4/2025,13:16:32,-07:00,2025-10-04T13:16:32-07:00,1,6
styles.css,26,css,e67fd98d,AHayslip23,10/4/2025,13:16:32,-07:00,2025-10-04T13:16:32-07:00,1,17
styles.css,27,css,e67fd98d,AHayslip23,10/4/2025,13:16:32,-07:00,2025-10-04T13:16:32-07:00,1,13
styles.css,28,css,e67fd98d,AHayslip23,10/4/2025,13:16:32,-07:00,2025-10-04T13:16:32-07:00,1,17
styles.css,29,css,e67fd98d,AHayslip23,10/4/2025,13:16:32,-07:00,2025-10-04T13:16:32-07:00,1,20
styles.css,30,css,e67fd98d,AHayslip23,10/4/2025,13:16:32,-07:00,2025-10-04T13:16:32-07:00,1,11
styles.css,31,css,e67fd98d,AHayslip23,10/4/2025,13:16:32,-07:00,2025-10-04T13:16:32-07:00,0,0
styles.css,32,css,e67fd98d,AHayslip23,10/4/2025,13:16:32,-07:00,2025-10-04T13:16:32-07:00,0,0
styles.css,33,css,e67fd98d,AHayslip23,10/4/2025,13:16:32,-07:00,2025-10-04T13:16:32-07:00,0,12
styles.css,34,css,9a492127,AHayslip23,10/4/2025,13:28:51,-07:00,2025-10-04T13:28:51-07:00,1,43
styles.css,35,css,9a492127,AHayslip23,10/4/2025,13:28:51,-07:00,2025-10-04T13:28:51-07:00,1,20
styles.css,36,css,9a492127,AHayslip23,10/4/2025,13:28:51,-07:00,2025-10-04T13:28:51-07:00,1,16
styles.css,37,css,e67fd98d,AHayslip23,10/4/2025,13:16:32,-07:00,2025-10-04T13:16:32-07:00,0,0
styles.css,38,css,e67fd98d,AHayslip23,10/4/2025,13:16:32,-07:00,2025-10-04T13:16:32-07:00,0,0
styles.css,39,css,d6f1bd3e,AHayslip23,10/4/2025,13:18:15,-07:00,2025-10-04T13:18:15-07:00,0,11
styles.css,40,css,99b48cc0,AHayslip23,10/14/2025,20:11:01,-07:00,2025-10-14T20:11:01-07:00,1,69
styles.css,41,css,d6f1bd3e,AHayslip23,10/4/2025,13:18:15,-07:00,2025-10-04T13:18:15-07:00,0,0
styles.css,42,css,d6f1bd3e,AHayslip23,10/4/2025,13:18:15,-07:00,2025-10-04T13:18:15-07:00,0,0
styles.css,43,css,3e36360c,AHayslip23,10/14/2025,20:19:13,-07:00,2025-10-14T20:19:13-07:00,0,13
styles.css,44,css,3e36360c,AHayslip23,10/14/2025,20:19:13,-07:00,2025-10-14T20:19:13-07:00,1,17
styles.css,45,css,3e36360c,AHayslip23,10/14/2025,20:19:13,-07:00,2025-10-14T20:19:13-07:00,1,8
styles.css,46,css,3e36360c,AHayslip23,10/14/2025,20:19:13,-07:00,2025-10-14T20:19:13-07:00,1,10
styles.css,47,css,3e36360c,AHayslip23,10/14/2025,20:19:13,-07:00,2025-10-14T20:19:13-07:00,1,16
styles.css,48,css,3e36360c,AHayslip23,10/14/2025,20:19:13,-07:00,2025-10-14T20:19:13-07:00,1,19
styles.css,49,css,facf4d3d,AHayslip23,10/4/2025,13:37:42,-07:00,2025-10-04T13:37:42-07:00,0,0
styles.css,50,css,facf4d3d,AHayslip23,10/4/2025,13:37:42,-07:00,2025-10-04T13:37:42-07:00,0,0
styles.css,51,css,3e36360c,AHayslip23,10/14/2025,20:19:13,-07:00,2025-10-14T20:19:13-07:00,0,20
styles.css,52,css,3e36360c,AHayslip23,10/14/2025,20:19:13,-07:00,2025-10-14T20:19:13-07:00,1,19
styles.css,53,css,99b48cc0,AHayslip23,10/14/2025,20:11:01,-07:00,2025-10-14T20:11:01-07:00,0,0
styles.css,54,css,99b48cc0,AHayslip23,10/14/2025,20:11:01,-07:00,2025-10-14T20:11:01-07:00,0,0
styles.css,55,css,3e36360c,AHayslip23,10/14/2025,20:19:13,-07:00,2025-10-14T20:19:13-07:00,0,0
styles.css,56,css,facf4d3d,AHayslip23,10/4/2025,13:37:42,-07:00,2025-10-04T13:37:42-07:00,0,23
styles.css,57,css,facf4d3d,AHayslip23,10/4/2025,13:37:42,-07:00,2025-10-04T13:37:42-07:00,1,12
styles.css,58,css,facf4d3d,AHayslip23,10/4/2025,13:37:42,-07:00,2025-10-04T13:37:42-07:00,0,0
styles.css,59,css,facf4d3d,AHayslip23,10/4/2025,13:37:42,-07:00,2025-10-04T13:37:42-07:00,0,0
styles.css,60,css,dffc1743,AHayslip23,10/4/2025,14:16:50,-07:00,2025-10-04T14:16:50-07:00,0,4
styles.css,61,css,dffc1743,AHayslip23,10/4/2025,14:16:50,-07:00,2025-10-04T14:16:50-07:00,0,12
styles.css,62,css,dffc1743,AHayslip23,10/4/2025,14:16:50,-07:00,2025-10-04T14:16:50-07:00,0,35
styles.css,63,css,dffc1743,AHayslip23,10/4/2025,14:16:50,-07:00,2025-10-04T14:16:50-07:00,0,7
styles.css,64,css,dffc1743,AHayslip23,10/4/2025,14:16:50,-07:00,2025-10-04T14:16:50-07:00,0,15
styles.css,65,css,dffc1743,AHayslip23,10/4/2025,14:16:50,-07:00,2025-10-04T14:16:50-07:00,0,0
styles.css,66,css,dffc1743,AHayslip23,10/4/2025,14:16:50,-07:00,2025-10-04T14:16:50-07:00,0,0
styles.css,67,css,dffc1743,AHayslip23,10/4/2025,14:16:50,-07:00,2025-10-04T14:16:50-07:00,0,9
styles.css,68,css,dffc1743,AHayslip23,10/4/2025,14:16:50,-07:00,2025-10-04T14:16:50-07:00,1,12
styles.css,69,css,dffc1743,AHayslip23,10/4/2025,14:16:50,-07:00,2025-10-04T14:16:50-07:00,1,29
styles.css,70,css,dffc1743,AHayslip23,10/4/2025,14:16:50,-07:00,2025-10-04T14:16:50-07:00,1,17
styles.css,71,css,dffc1743,AHayslip23,10/4/2025,14:16:50,-07:00,2025-10-04T14:16:50-07:00,0,0
styles.css,72,css,dffc1743,AHayslip23,10/4/2025,14:16:50,-07:00,2025-10-04T14:16:50-07:00,0,0
styles.css,73,css,facf4d3d,AHayslip23,10/4/2025,13:37:42,-07:00,2025-10-04T13:37:42-07:00,0,8
styles.css,74,css,dffc1743,AHayslip23,10/4/2025,14:16:50,-07:00,2025-10-04T14:16:50-07:00,0,12
styles.css,75,css,facf4d3d,AHayslip23,10/4/2025,13:37:42,-07:00,2025-10-04T13:37:42-07:00,1,10
styles.css,76,css,facf4d3d,AHayslip23,10/4/2025,13:37:42,-07:00,2025-10-04T13:37:42-07:00,1,21
styles.css,77,css,facf4d3d,AHayslip23,10/4/2025,13:37:42,-07:00,2025-10-04T13:37:42-07:00,0,0
styles.css,78,css,facf4d3d,AHayslip23,10/4/2025,13:37:42,-07:00,2025-10-04T13:37:42-07:00,0,0
styles.css,79,css,dffc1743,AHayslip23,10/4/2025,14:16:50,-07:00,2025-10-04T14:16:50-07:00,0,10
styles.css,80,css,dffc1743,AHayslip23,10/4/2025,14:16:50,-07:00,2025-10-04T14:16:50-07:00,1,18
styles.css,81,css,dffc1743,AHayslip23,10/4/2025,14:16:50,-07:00,2025-10-04T14:16:50-07:00,1,17
styles.css,82,css,377ef30a,AHayslip23,10/4/2025,14:30:19,-07:00,2025-10-04T14:30:19-07:00,0,0
styles.css,83,css,377ef30a,AHayslip23,10/4/2025,14:30:19,-07:00,2025-10-04T14:30:19-07:00,0,0
styles.css,84,css,b8c7a6bc,AHayslip23,10/19/2025,23:55:13,-07:00,2025-10-19T23:55:13-07:00,0,8
styles.css,85,css,b8c7a6bc,AHayslip23,10/19/2025,23:55:13,-07:00,2025-10-19T23:55:13-07:00,1,12
styles.css,86,css,5256c439,AHayslip23,10/19/2025,23:47:25,-07:00,2025-10-19T23:47:25-07:00,1,36
styles.css,87,css,b8c7a6bc,AHayslip23,10/19/2025,23:55:13,-07:00,2025-10-19T23:55:13-07:00,1,7
styles.css,88,css,b8c7a6bc,AHayslip23,10/19/2025,23:55:13,-07:00,2025-10-19T23:55:13-07:00,1,20
styles.css,89,css,b8c7a6bc,AHayslip23,10/19/2025,23:55:13,-07:00,2025-10-19T23:55:13-07:00,1,16
styles.css,90,css,b8c7a6bc,AHayslip23,10/19/2025,23:55:13,-07:00,2025-10-19T23:55:13-07:00,1,12
styles.css,91,css,b8c7a6bc,AHayslip23,10/19/2025,23:55:13,-07:00,2025-10-19T23:55:13-07:00,1,16
styles.css,92,css,763577c3,AHayslip23,10/20/2025,20:33:49,-07:00,2025-10-20T20:33:49-07:00,0,0
styles.css,93,css,377ef30a,AHayslip23,10/4/2025,14:30:19,-07:00,2025-10-04T14:30:19-07:00,0,0
styles.css,94,css,377ef30a,AHayslip23,10/4/2025,14:30:19,-07:00,2025-10-04T14:30:19-07:00,0,16
styles.css,95,css,1a917eb7,AHayslip23,10/19/2025,21:39:03,-07:00,2025-10-19T21:39:03-07:00,1,24
styles.css,96,css,1a917eb7,AHayslip23,10/19/2025,21:39:03,-07:00,2025-10-19T21:39:03-07:00,1,18
styles.css,97,css,1a917eb7,AHayslip23,10/19/2025,21:39:03,-07:00,2025-10-19T21:39:03-07:00,1,40
styles.css,98,css,1a917eb7,AHayslip23,10/19/2025,21:39:03,-07:00,2025-10-19T21:39:03-07:00,1,12
styles.css,99,css,1a917eb7,AHayslip23,10/19/2025,21:39:03,-07:00,2025-10-19T21:39:03-07:00,1,17
styles.css,100,css,1a917eb7,AHayslip23,10/19/2025,21:39:03,-07:00,2025-10-19T21:39:03-07:00,1,52
styles.css,101,css,1a917eb7,AHayslip23,10/19/2025,21:39:03,-07:00,2025-10-19T21:39:03-07:00,1,10
styles.css,102,css,1a917eb7,AHayslip23,10/19/2025,21:39:03,-07:00,2025-10-19T21:39:03-07:00,1,15
styles.css,103,css,bf173dbe,AHayslip23,10/19/2025,21:53:51,-07:00,2025-10-19T21:53:51-07:00,1,12
styles.css,104,css,bf173dbe,AHayslip23,10/19/2025,21:53:51,-07:00,2025-10-19T21:53:51-07:00,1,21
styles.css,105,css,bf173dbe,AHayslip23,10/19/2025,21:53:51,-07:00,2025-10-19T21:53:51-07:00,1,18
styles.css,106,css,bf173dbe,AHayslip23,10/19/2025,21:53:51,-07:00,2025-10-19T21:53:51-07:00,1,52
styles.css,107,css,1a917eb7,AHayslip23,10/19/2025,21:39:03,-07:00,2025-10-19T21:39:03-07:00,0,0
styles.css,108,css,1a917eb7,AHayslip23,10/19/2025,21:39:03,-07:00,2025-10-19T21:39:03-07:00,0,0
styles.css,109,css,1a917eb7,AHayslip23,10/19/2025,21:39:03,-07:00,2025-10-19T21:39:03-07:00,0,23
styles.css,110,css,1a917eb7,AHayslip23,10/19/2025,21:39:03,-07:00,2025-10-19T21:39:03-07:00,1,26
styles.css,111,css,1a917eb7,AHayslip23,10/19/2025,21:39:03,-07:00,2025-10-19T21:39:03-07:00,1,40
styles.css,112,css,1a917eb7,AHayslip23,10/19/2025,21:39:03,-07:00,2025-10-19T21:39:03-07:00,0,0
styles.css,113,css,377ef30a,AHayslip23,10/4/2025,14:30:19,-07:00,2025-10-04T14:30:19-07:00,0,0
styles.css,114,css,377ef30a,AHayslip23,10/4/2025,14:30:19,-07:00,2025-10-04T14:30:19-07:00,0,0
styles.css,115,css,bf173dbe,AHayslip23,10/19/2025,21:53:51,-07:00,2025-10-19T21:53:51-07:00,0,21
styles.css,116,css,0b56c733,AHayslip23,10/19/2025,23:44:31,-07:00,2025-10-19T23:44:31-07:00,1,12
styles.css,117,css,0b56c733,AHayslip23,10/19/2025,23:44:31,-07:00,2025-10-19T23:44:31-07:00,1,20
styles.css,118,css,bf173dbe,AHayslip23,10/19/2025,21:53:51,-07:00,2025-10-19T21:53:51-07:00,0,0
styles.css,119,css,bf173dbe,AHayslip23,10/19/2025,21:53:51,-07:00,2025-10-19T21:53:51-07:00,0,0
styles.css,120,css,0b56c733,AHayslip23,10/19/2025,23:44:31,-07:00,2025-10-19T23:44:31-07:00,0,37
styles.css,121,css,0b56c733,AHayslip23,10/19/2025,23:44:31,-07:00,2025-10-19T23:44:31-07:00,1,12
styles.css,122,css,0b56c733,AHayslip23,10/19/2025,23:44:31,-07:00,2025-10-19T23:44:31-07:00,0,0
styles.css,123,css,0b56c733,AHayslip23,10/19/2025,23:44:31,-07:00,2025-10-19T23:44:31-07:00,0,0
styles.css,124,css,0b56c733,AHayslip23,10/19/2025,23:44:31,-07:00,2025-10-19T23:44:31-07:00,0,12
styles.css,125,css,0b56c733,AHayslip23,10/19/2025,23:44:31,-07:00,2025-10-19T23:44:31-07:00,1,15
styles.css,126,css,0b56c733,AHayslip23,10/19/2025,23:44:31,-07:00,2025-10-19T23:44:31-07:00,0,0
styles.css,127,css,0b56c733,AHayslip23,10/19/2025,23:44:31,-07:00,2025-10-19T23:44:31-07:00,0,12
styles.css,128,css,0b56c733,AHayslip23,10/19/2025,23:44:31,-07:00,2025-10-19T23:44:31-07:00,1,15
styles.css,129,css,377ef30a,AHayslip23,10/4/2025,14:30:19,-07:00,2025-10-04T14:30:19-07:00,0,0
styles.css,130,css,377ef30a,AHayslip23,10/4/2025,14:30:19,-07:00,2025-10-04T14:30:19-07:00,0,0
styles.css,131,css,3952e343,AHayslip23,10/4/2025,14:35:23,-07:00,2025-10-04T14:35:23-07:00,0,2
styles.css,132,css,3952e343,AHayslip23,10/4/2025,14:35:23,-07:00,2025-10-04T14:35:23-07:00,2,14
styles.css,133,css,3952e343,AHayslip23,10/4/2025,14:35:23,-07:00,2025-10-04T14:35:23-07:00,2,15
styles.css,134,css,3952e343,AHayslip23,10/4/2025,14:35:23,-07:00,2025-10-04T14:35:23-07:00,2,17
styles.css,135,css,3952e343,AHayslip23,10/4/2025,14:35:23,-07:00,2025-10-04T14:35:23-07:00,0,0
styles.css,136,css,3952e343,AHayslip23,10/4/2025,14:35:23,-07:00,2025-10-04T14:35:23-07:00,0,0
styles.css,137,css,3952e343,AHayslip23,10/4/2025,14:35:23,-07:00,2025-10-04T14:35:23-07:00,0,18
styles.css,138,css,3952e343,AHayslip23,10/4/2025,14:35:23,-07:00,2025-10-04T14:35:23-07:00,2,15
styles.css,139,css,3952e343,AHayslip23,10/4/2025,14:35:23,-07:00,2025-10-04T14:35:23-07:00,2,17
styles.css,140,css,4109f81a,AHayslip23,10/4/2025,15:13:39,-07:00,2025-10-04T15:13:39-07:00,0,0
styles.css,141,css,4109f81a,AHayslip23,10/4/2025,15:13:39,-07:00,2025-10-04T15:13:39-07:00,0,0
styles.css,142,css,4109f81a,AHayslip23,10/4/2025,15:13:39,-07:00,2025-10-04T15:13:39-07:00,0,16
styles.css,143,css,ae1f7ad4,AHayslip23,10/19/2025,23:54:19,-07:00,2025-10-19T23:54:19-07:00,1,36
styles.css,144,css,4109f81a,AHayslip23,10/4/2025,15:13:39,-07:00,2025-10-04T15:13:39-07:00,1,9
styles.css,145,css,4109f81a,AHayslip23,10/4/2025,15:13:39,-07:00,2025-10-04T15:13:39-07:00,1,26
styles.css,146,css,4109f81a,AHayslip23,10/4/2025,15:13:39,-07:00,2025-10-04T15:13:39-07:00,1,16
styles.css,147,css,4109f81a,AHayslip23,10/4/2025,15:13:39,-07:00,2025-10-04T15:13:39-07:00,1,17
styles.css,148,css,4109f81a,AHayslip23,10/4/2025,15:13:39,-07:00,2025-10-04T15:13:39-07:00,1,18
styles.css,149,css,4109f81a,AHayslip23,10/4/2025,15:13:39,-07:00,2025-10-04T15:13:39-07:00,0,40
styles.css,150,css,4109f81a,AHayslip23,10/4/2025,15:13:39,-07:00,2025-10-04T15:13:39-07:00,0,0
styles.css,151,css,4109f81a,AHayslip23,10/4/2025,15:13:39,-07:00,2025-10-04T15:13:39-07:00,0,0
styles.css,152,css,4109f81a,AHayslip23,10/4/2025,15:13:39,-07:00,2025-10-04T15:13:39-07:00,0,2
styles.css,153,css,4109f81a,AHayslip23,10/4/2025,15:13:39,-07:00,2025-10-04T15:13:39-07:00,1,17
styles.css,154,css,1a917eb7,AHayslip23,10/19/2025,21:39:03,-07:00,2025-10-19T21:39:03-07:00,1,15
styles.css,155,css,1a917eb7,AHayslip23,10/19/2025,21:39:03,-07:00,2025-10-19T21:39:03-07:00,1,14
styles.css,156,css,4109f81a,AHayslip23,10/4/2025,15:13:39,-07:00,2025-10-04T15:13:39-07:00,1,13
styles.css,157,css,4109f81a,AHayslip23,10/4/2025,15:13:39,-07:00,2025-10-04T15:13:39-07:00,0,0
styles.css,158,css,4109f81a,AHayslip23,10/4/2025,15:13:39,-07:00,2025-10-04T15:13:39-07:00,0,0
styles.css,159,css,4109f81a,AHayslip23,10/4/2025,15:13:39,-07:00,2025-10-04T15:13:39-07:00,0,2
styles.css,160,css,4109f81a,AHayslip23,10/4/2025,15:13:39,-07:00,2025-10-04T15:13:39-07:00,1,15
styles.css,161,css,4109f81a,AHayslip23,10/4/2025,15:13:39,-07:00,2025-10-04T15:13:39-07:00,1,13
styles.css,162,css,4109f81a,AHayslip23,10/4/2025,15:13:39,-07:00,2025-10-04T15:13:39-07:00,1,15
styles.css,163,css,4109f81a,AHayslip23,10/4/2025,15:13:39,-07:00,2025-10-04T15:13:39-07:00,1,31
styles.css,164,css,4109f81a,AHayslip23,10/4/2025,15:13:39,-07:00,2025-10-04T15:13:39-07:00,1,21
styles.css,165,css,4109f81a,AHayslip23,10/4/2025,15:13:39,-07:00,2025-10-04T15:13:39-07:00,0,0
styles.css,166,css,4109f81a,AHayslip23,10/4/2025,15:13:39,-07:00,2025-10-04T15:13:39-07:00,0,0
styles.css,167,css,4109f81a,AHayslip23,10/4/2025,15:13:39,-07:00,2025-10-04T15:13:39-07:00,0,13
styles.css,168,css,4109f81a,AHayslip23,10/4/2025,15:13:39,-07:00,2025-10-04T15:13:39-07:00,1,16
styles.css,169,css,4109f81a,AHayslip23,10/4/2025,15:13:39,-07:00,2025-10-04T15:13:39-07:00,1,16
styles.css,170,css,4109f81a,AHayslip23,10/4/2025,15:13:39,-07:00,2025-10-04T15:13:39-07:00,1,15
styles.css,171,css,4109f81a,AHayslip23,10/4/2025,15:13:39,-07:00,2025-10-04T15:13:39-07:00,1,20
styles.css,172,css,4109f81a,AHayslip23,10/4/2025,15:13:39,-07:00,2025-10-04T15:13:39-07:00,1,13
styles.css,173,css,4109f81a,AHayslip23,10/4/2025,15:13:39,-07:00,2025-10-04T15:13:39-07:00,0,0
styles.css,174,css,4109f81a,AHayslip23,10/4/2025,15:13:39,-07:00,2025-10-04T15:13:39-07:00,0,0
styles.css,175,css,4109f81a,AHayslip23,10/4/2025,15:13:39,-07:00,2025-10-04T15:13:39-07:00,0,23
styles.css,176,css,4109f81a,AHayslip23,10/4/2025,15:13:39,-07:00,2025-10-04T15:13:39-07:00,1,15
styles.css,177,css,4109f81a,AHayslip23,10/4/2025,15:13:39,-07:00,2025-10-04T15:13:39-07:00,0,0
styles.css,178,css,4109f81a,AHayslip23,10/4/2025,15:13:39,-07:00,2025-10-04T15:13:39-07:00,0,0
styles.css,179,css,4109f81a,AHayslip23,10/4/2025,15:13:39,-07:00,2025-10-04T15:13:39-07:00,0,3
styles.css,180,css,4109f81a,AHayslip23,10/4/2025,15:13:39,-07:00,2025-10-04T15:13:39-07:00,1,34
styles.css,181,css,4109f81a,AHayslip23,10/4/2025,15:13:39,-07:00,2025-10-04T15:13:39-07:00,1,13
styles.css,182,css,4109f81a,AHayslip23,10/4/2025,15:13:39,-07:00,2025-10-04T15:13:39-07:00,0,0
styles.css,183,css,4109f81a,AHayslip23,10/4/2025,15:13:39,-07:00,2025-10-04T15:13:39-07:00,0,0
styles.css,184,css,4109f81a,AHayslip23,10/4/2025,15:13:39,-07:00,2025-10-04T15:13:39-07:00,0,2
styles.css,185,css,4109f81a,AHayslip23,10/4/2025,15:13:39,-07:00,2025-10-04T15:13:39-07:00,1,16
styles.css,186,css,4109f81a,AHayslip23,10/4/2025,15:13:39,-07:00,2025-10-04T15:13:39-07:00,1,18
styles.css,187,css,4109f81a,AHayslip23,10/4/2025,15:13:39,-07:00,2025-10-04T15:13:39-07:00,0,0
styles.css,188,css,4109f81a,AHayslip23,10/4/2025,15:13:39,-07:00,2025-10-04T15:13:39-07:00,0,0
styles.css,189,css,4109f81a,AHayslip23,10/4/2025,15:13:39,-07:00,2025-10-04T15:13:39-07:00,0,5
styles.css,190,css,4109f81a,AHayslip23,10/4/2025,15:13:39,-07:00,2025-10-04T15:13:39-07:00,1,20
styles.css,191,css,4109f81a,AHayslip23,10/4/2025,15:13:39,-07:00,2025-10-04T15:13:39-07:00,0,0
styles.css,192,css,4109f81a,AHayslip23,10/4/2025,15:13:39,-07:00,2025-10-04T15:13:39-07:00,0,0
styles.css,193,css,4109f81a,AHayslip23,10/4/2025,15:13:39,-07:00,2025-10-04T15:13:39-07:00,0,22
styles.css,194,css,4109f81a,AHayslip23,10/4/2025,15:13:39,-07:00,2025-10-04T15:13:39-07:00,1,12
styles.css,195,css,4109f81a,AHayslip23,10/4/2025,15:13:39,-07:00,2025-10-04T15:13:39-07:00,1,58
styles.css,196,css,4109f81a,AHayslip23,10/4/2025,15:13:39,-07:00,2025-10-04T15:13:39-07:00,1,8
styles.css,197,css,4109f81a,AHayslip23,10/4/2025,15:13:39,-07:00,2025-10-04T15:13:39-07:00,1,22
styles.css,198,css,4109f81a,AHayslip23,10/4/2025,15:13:39,-07:00,2025-10-04T15:13:39-07:00,0,0
styles.css,199,css,4109f81a,AHayslip23,10/4/2025,15:13:39,-07:00,2025-10-04T15:13:39-07:00,0,0
styles.css,200,css,4109f81a,AHayslip23,10/4/2025,15:13:39,-07:00,2025-10-04T15:13:39-07:00,0,13
styles.css,201,css,4109f81a,AHayslip23,10/4/2025,15:13:39,-07:00,2025-10-04T15:13:39-07:00,1,16
styles.css,202,css,4109f81a,AHayslip23,10/4/2025,15:13:39,-07:00,2025-10-04T15:13:39-07:00,1,16
styles.css,203,css,4109f81a,AHayslip23,10/4/2025,15:13:39,-07:00,2025-10-04T15:13:39-07:00,1,25
styles.css,204,css,88091d84,AHayslip23,10/19/2025,19:45:28,-07:00,2025-10-19T19:45:28-07:00,0,0
styles.css,205,css,88091d84,AHayslip23,10/19/2025,19:45:28,-07:00,2025-10-19T19:45:28-07:00,0,0
styles.css,206,css,88091d84,AHayslip23,10/19/2025,19:45:28,-07:00,2025-10-19T19:45:28-07:00,0,17
styles.css,207,css,88091d84,AHayslip23,10/19/2025,19:45:28,-07:00,2025-10-19T19:45:28-07:00,1,12
styles.css,208,css,88091d84,AHayslip23,10/19/2025,19:45:28,-07:00,2025-10-19T19:45:28-07:00,1,36
styles.css,209,css,88091d84,AHayslip23,10/19/2025,19:45:28,-07:00,2025-10-19T19:45:28-07:00,1,17
styles.css,210,css,88091d84,AHayslip23,10/19/2025,19:45:28,-07:00,2025-10-19T19:45:28-07:00,1,8
styles.css,211,css,88091d84,AHayslip23,10/19/2025,19:45:28,-07:00,2025-10-19T19:45:28-07:00,0,0
styles.css,212,css,88091d84,AHayslip23,10/19/2025,19:45:28,-07:00,2025-10-19T19:45:28-07:00,0,0
styles.css,213,css,88091d84,AHayslip23,10/19/2025,19:45:28,-07:00,2025-10-19T19:45:28-07:00,0,17
styles.css,214,css,88091d84,AHayslip23,10/19/2025,19:45:28,-07:00,2025-10-19T19:45:28-07:00,1,16
styles.css,215,css,88091d84,AHayslip23,10/19/2025,19:45:28,-07:00,2025-10-19T19:45:28-07:00,1,10
styles.css,216,css,88091d84,AHayslip23,10/19/2025,19:45:28,-07:00,2025-10-19T19:45:28-07:00,0,0
styles.css,217,css,88091d84,AHayslip23,10/19/2025,19:45:28,-07:00,2025-10-19T19:45:28-07:00,0,0
styles.css,218,css,88091d84,AHayslip23,10/19/2025,19:45:28,-07:00,2025-10-19T19:45:28-07:00,0,17
styles.css,219,css,88091d84,AHayslip23,10/19/2025,19:45:28,-07:00,2025-10-19T19:45:28-07:00,1,10
styles.css,220,css,88091d84,AHayslip23,10/19/2025,19:45:28,-07:00,2025-10-19T19:45:28-07:00,1,8
styles.css,221,css,b5d0baf5,AHayslip23,10/19/2025,20:13:19,-07:00,2025-10-19T20:13:19-07:00,0,0
styles.css,222,css,b5d0baf5,AHayslip23,10/19/2025,20:13:19,-07:00,2025-10-19T20:13:19-07:00,0,0
styles.css,223,css,03d013f3,AHayslip23,10/19/2025,21:07:53,-07:00,2025-10-19T21:07:53-07:00,0,11
styles.css,224,css,1a917eb7,AHayslip23,10/19/2025,21:39:03,-07:00,2025-10-19T21:39:03-07:00,1,10
styles.css,225,css,71cae616,AHayslip23,10/19/2025,21:47:49,-07:00,2025-10-19T21:47:49-07:00,1,12
styles.css,226,css,71cae616,AHayslip23,10/19/2025,21:47:49,-07:00,2025-10-19T21:47:49-07:00,1,11
styles.css,227,css,1a917eb7,AHayslip23,10/19/2025,21:39:03,-07:00,2025-10-19T21:39:03-07:00,1,18
styles.css,228,css,1a917eb7,AHayslip23,10/19/2025,21:39:03,-07:00,2025-10-19T21:39:03-07:00,1,17
styles.css,229,css,1a917eb7,AHayslip23,10/19/2025,21:39:03,-07:00,2025-10-19T21:39:03-07:00,1,18
styles.css,230,css,1a917eb7,AHayslip23,10/19/2025,21:39:03,-07:00,2025-10-19T21:39:03-07:00,0,0
styles.css,231,css,1a917eb7,AHayslip23,10/19/2025,21:39:03,-07:00,2025-10-19T21:39:03-07:00,0,0
styles.css,232,css,1a917eb7,AHayslip23,10/19/2025,21:39:03,-07:00,2025-10-19T21:39:03-07:00,0,11
styles.css,233,css,1a917eb7,AHayslip23,10/19/2025,21:39:03,-07:00,2025-10-19T21:39:03-07:00,1,17
styles.css,234,css,1a917eb7,AHayslip23,10/19/2025,21:39:03,-07:00,2025-10-19T21:39:03-07:00,1,10
styles.css,235,css,1a917eb7,AHayslip23,10/19/2025,21:39:03,-07:00,2025-10-19T21:39:03-07:00,1,17
styles.css,236,css,763577c3,AHayslip23,10/20/2025,20:33:49,-07:00,2025-10-20T20:33:49-07:00,0,0
styles.css,237,css,763577c3,AHayslip23,10/20/2025,20:33:49,-07:00,2025-10-20T20:33:49-07:00,0,0
styles.css,238,css,763577c3,AHayslip23,10/20/2025,20:33:49,-07:00,2025-10-20T20:33:49-07:00,0,9
styles.css,239,css,763577c3,AHayslip23,10/20/2025,20:33:49,-07:00,2025-10-20T20:33:49-07:00,1,17
styles.css,240,css,763577c3,AHayslip23,10/20/2025,20:33:49,-07:00,2025-10-20T20:33:49-07:00,1,20
styles.css,241,css,763577c3,AHayslip23,10/20/2025,20:33:49,-07:00,2025-10-20T20:33:49-07:00,0,0
styles.css,242,css,763577c3,AHayslip23,10/20/2025,20:33:49,-07:00,2025-10-20T20:33:49-07:00,0,0
styles.css,243,css,763577c3,AHayslip23,10/20/2025,20:33:49,-07:00,2025-10-20T20:33:49-07:00,0,8
styles.css,244,css,763577c3,AHayslip23,10/20/2025,20:33:49,-07:00,2025-10-20T20:33:49-07:00,1,15
styles.css,245,css,763577c3,AHayslip23,10/20/2025,20:33:49,-07:00,2025-10-20T20:33:49-07:00,1,11
styles.css,246,css,763577c3,AHayslip23,10/20/2025,20:33:49,-07:00,2025-10-20T20:33:49-07:00,1,13
styles.css,247,css,763577c3,AHayslip23,10/20/2025,20:33:49,-07:00,2025-10-20T20:33:49-07:00,1,12
styles.css,248,css,763577c3,AHayslip23,10/20/2025,20:33:49,-07:00,2025-10-20T20:33:49-07:00,1,14
styles.css,249,css,763577c3,AHayslip23,10/20/2025,20:33:49,-07:00,2025-10-20T20:33:49-07:00,1,11
styles.css,250,css,763577c3,AHayslip23,10/20/2025,20:33:49,-07:00,2025-10-20T20:33:49-07:00,0,0
styles.css,251,css,763577c3,AHayslip23,10/20/2025,20:33:49,-07:00,2025-10-20T20:33:49-07:00,0,0
styles.css,252,css,763577c3,AHayslip23,10/20/2025,20:33:49,-07:00,2025-10-20T20:33:49-07:00,0,17
styles.css,253,css,763577c3,AHayslip23,10/20/2025,20:33:49,-07:00,2025-10-20T20:33:49-07:00,1,12
styles.css,254,css,763577c3,AHayslip23,10/20/2025,20:33:49,-07:00,2025-10-20T20:33:49-07:00,1,17
styles.css,255,css,763577c3,AHayslip23,10/20/2025,20:33:49,-07:00,2025-10-20T20:33:49-07:00,1,22
styles.css,256,css,763577c3,AHayslip23,10/20/2025,20:33:49,-07:00,2025-10-20T20:33:49-07:00,1,15
styles.css,257,css,763577c3,AHayslip23,10/20/2025,20:33:49,-07:00,2025-10-20T20:33:49-07:00,1,39
styles.css,258,css,763577c3,AHayslip23,10/20/2025,20:33:49,-07:00,2025-10-20T20:33:49-07:00,1,10
styles.css,259,css,763577c3,AHayslip23,10/20/2025,20:33:49,-07:00,2025-10-20T20:33:49-07:00,0,0
styles.css,260,css,763577c3,AHayslip23,10/20/2025,20:33:49,-07:00,2025-10-20T20:33:49-07:00,0,0
styles.css,261,css,763577c3,AHayslip23,10/20/2025,20:33:49,-07:00,2025-10-20T20:33:49-07:00,0,19
styles.css,262,css,763577c3,AHayslip23,10/20/2025,20:33:49,-07:00,2025-10-20T20:33:49-07:00,1,11
styles.css,263,css,763577c3,AHayslip23,10/20/2025,20:33:49,-07:00,2025-10-20T20:33:49-07:00,1,18
styles.css,264,css,763577c3,AHayslip23,10/20/2025,20:33:49,-07:00,2025-10-20T20:33:49-07:00,1,20
styles.css,265,css,763577c3,AHayslip23,10/20/2025,20:33:49,-07:00,2025-10-20T20:33:49-07:00,1,13
styles.css,266,css,763577c3,AHayslip23,10/20/2025,20:33:49,-07:00,2025-10-20T20:33:49-07:00,0,0
styles.css,267,css,763577c3,AHayslip23,10/20/2025,20:33:49,-07:00,2025-10-20T20:33:49-07:00,0,0
styles.css,268,css,763577c3,AHayslip23,10/20/2025,20:33:49,-07:00,2025-10-20T20:33:49-07:00,0,33
styles.css,269,css,763577c3,AHayslip23,10/20/2025,20:33:49,-07:00,2025-10-20T20:33:49-07:00,1,13
styles.css,270,css,763577c3,AHayslip23,10/20/2025,20:33:49,-07:00,2025-10-20T20:33:49-07:00,0,0
styles.css,271,css,763577c3,AHayslip23,10/20/2025,20:33:49,-07:00,2025-10-20T20:33:49-07:00,0,0
styles.css,272,css,763577c3,AHayslip23,10/20/2025,20:33:49,-07:00,2025-10-20T20:33:49-07:00,0,25
styles.css,273,css,763577c3,AHayslip23,10/20/2025,20:33:49,-07:00,2025-10-20T20:33:49-07:00,1,26
styles.css,274,css,0b86e2e5,AHayslip23,10/28/2025,20:55:45,-07:00,2025-10-28T20:55:45-07:00,0,0
styles.css,275,css,0b86e2e5,AHayslip23,10/28/2025,20:55:45,-07:00,2025-10-28T20:55:45-07:00,0,0
styles.css,276,css,0b86e2e5,AHayslip23,10/28/2025,20:55:45,-07:00,2025-10-28T20:55:45-07:00,0,13
styles.css,277,css,0b86e2e5,AHayslip23,10/28/2025,20:55:45,-07:00,2025-10-28T20:55:45-07:00,1,12
styles.css,278,css,0b86e2e5,AHayslip23,10/28/2025,20:55:45,-07:00,2025-10-28T20:55:45-07:00,1,21
styles.css,279,css,0b86e2e5,AHayslip23,10/28/2025,20:55:45,-07:00,2025-10-28T20:55:45-07:00,1,10
styles.css,280,css,0b86e2e5,AHayslip23,10/28/2025,20:55:45,-07:00,2025-10-28T20:55:45-07:00,0,0
styles.css,281,css,0b86e2e5,AHayslip23,10/28/2025,20:55:45,-07:00,2025-10-28T20:55:45-07:00,0,0
styles.css,282,css,0b86e2e5,AHayslip23,10/28/2025,20:55:45,-07:00,2025-10-28T20:55:45-07:00,0,13
styles.css,283,css,0b86e2e5,AHayslip23,10/28/2025,20:55:45,-07:00,2025-10-28T20:55:45-07:00,1,30
styles.css,284,css,0b86e2e5,AHayslip23,10/28/2025,20:55:45,-07:00,2025-10-28T20:55:45-07:00,1,16
styles.css,285,css,0b86e2e5,AHayslip23,10/28/2025,20:55:45,-07:00,2025-10-28T20:55:45-07:00,1,34
styles.css,286,css,b79506e3,AHayslip23,10/28/2025,21:46:11,-07:00,2025-10-28T21:46:11-07:00,1,24
styles.css,287,css,38276390,AHayslip23,10/28/2025,21:10:56,-07:00,2025-10-28T21:10:56-07:00,0,0
styles.css,288,css,38276390,AHayslip23,10/28/2025,21:10:56,-07:00,2025-10-28T21:10:56-07:00,0,0
styles.css,289,css,38276390,AHayslip23,10/28/2025,21:10:56,-07:00,2025-10-28T21:10:56-07:00,0,18
styles.css,290,css,1720dfc8,AHayslip23,10/29/2025,21:18:06,-07:00,2025-10-29T21:18:06-07:00,1,13
styles.css,291,css,6dedb6fd,AHayslip23,10/29/2025,22:03:19,-07:00,2025-10-29T22:03:19-07:00,1,11
styles.css,292,css,6dedb6fd,AHayslip23,10/29/2025,22:03:19,-07:00,2025-10-29T22:03:19-07:00,1,12
styles.css,293,css,c1436ef4,AHayslip23,10/29/2025,21:46:36,-07:00,2025-10-29T21:46:36-07:00,1,14
styles.css,294,css,38276390,AHayslip23,10/28/2025,21:10:56,-07:00,2025-10-28T21:10:56-07:00,1,16
styles.css,295,css,6467f31f,AHayslip23,10/28/2025,21:20:33,-07:00,2025-10-28T21:20:33-07:00,1,16
styles.css,296,css,e16262b4,AHayslip23,10/29/2025,20:52:10,-07:00,2025-10-29T20:52:10-07:00,1,14
styles.css,297,css,c0bcf46c,AHayslip23,10/29/2025,21:38:03,-07:00,2025-10-29T21:38:03-07:00,1,17
styles.css,298,css,7b379cf0,AHayslip23,10/29/2025,21:56:41,-07:00,2025-10-29T21:56:41-07:00,1,13
styles.css,299,css,e16262b4,AHayslip23,10/29/2025,20:52:10,-07:00,2025-10-29T20:52:10-07:00,1,36
styles.css,300,css,871f0dd3,AHayslip23,10/28/2025,21:41:10,-07:00,2025-10-28T21:41:10-07:00,0,0
styles.css,301,css,871f0dd3,AHayslip23,10/28/2025,21:41:10,-07:00,2025-10-28T21:41:10-07:00,0,0
styles.css,302,css,a22e5e1a,AHayslip23,10/29/2025,21:05:05,-07:00,2025-10-29T21:05:05-07:00,0,51
styles.css,303,css,a22e5e1a,AHayslip23,10/29/2025,21:05:05,-07:00,2025-10-29T21:05:05-07:00,1,11
styles.css,304,css,a22e5e1a,AHayslip23,10/29/2025,21:05:05,-07:00,2025-10-29T21:05:05-07:00,0,0
styles.css,305,css,a22e5e1a,AHayslip23,10/29/2025,21:05:05,-07:00,2025-10-29T21:05:05-07:00,0,0
styles.css,306,css,871f0dd3,AHayslip23,10/28/2025,21:41:10,-07:00,2025-10-28T21:41:10-07:00,0,14
styles.css,307,css,ae883871,AHayslip23,10/29/2025,22:06:47,-07:00,2025-10-29T22:06:47-07:00,1,12
styles.css,308,css,ae883871,AHayslip23,10/29/2025,22:06:47,-07:00,2025-10-29T22:06:47-07:00,1,18
styles.css,309,css,ae883871,AHayslip23,10/29/2025,22:06:47,-07:00,2025-10-29T22:06:47-07:00,1,22
styles.css,310,css,ae883871,AHayslip23,10/29/2025,22:06:47,-07:00,2025-10-29T22:06:47-07:00,1,10
styles.css,311,css,ae883871,AHayslip23,10/29/2025,22:06:47,-07:00,2025-10-29T22:06:47-07:00,1,26
styles.css,312,css,ae883871,AHayslip23,10/29/2025,22:06:47,-07:00,2025-10-29T22:06:47-07:00,1,16
styles.css,313,css,ae883871,AHayslip23,10/29/2025,22:06:47,-07:00,2025-10-29T22:06:47-07:00,1,14
styles.css,314,css,871f0dd3,AHayslip23,10/28/2025,21:41:10,-07:00,2025-10-28T21:41:10-07:00,0,0
styles.css,315,css,871f0dd3,AHayslip23,10/28/2025,21:41:10,-07:00,2025-10-28T21:41:10-07:00,0,0
styles.css,316,css,871f0dd3,AHayslip23,10/28/2025,21:41:10,-07:00,2025-10-28T21:41:10-07:00,0,7
styles.css,317,css,ae883871,AHayslip23,10/29/2025,22:06:47,-07:00,2025-10-29T22:06:47-07:00,1,14
styles.css,318,css,871f0dd3,AHayslip23,10/28/2025,21:41:10,-07:00,2025-10-28T21:41:10-07:00,1,15
styles.css,319,css,7b379cf0,AHayslip23,10/29/2025,21:56:41,-07:00,2025-10-29T21:56:41-07:00,1,19
styles.css,320,css,231a37a1,AHayslip23,10/29/2025,21:23:59,-07:00,2025-10-29T21:23:59-07:00,1,21
styles.css,321,css,7b379cf0,AHayslip23,10/29/2025,21:56:41,-07:00,2025-10-29T21:56:41-07:00,1,17
styles.css,322,css,7b379cf0,AHayslip23,10/29/2025,21:56:41,-07:00,2025-10-29T21:56:41-07:00,1,22
styles.css,323,css,871f0dd3,AHayslip23,10/28/2025,21:41:10,-07:00,2025-10-28T21:41:10-07:00,1,12
styles.css,324,css,231a37a1,AHayslip23,10/29/2025,21:23:59,-07:00,2025-10-29T21:23:59-07:00,1,10
styles.css,325,css,7b379cf0,AHayslip23,10/29/2025,21:56:41,-07:00,2025-10-29T21:56:41-07:00,1,25
styles.css,326,css,1720dfc8,AHayslip23,10/29/2025,21:18:06,-07:00,2025-10-29T21:18:06-07:00,1,16
styles.css,327,css,231a37a1,AHayslip23,10/29/2025,21:23:59,-07:00,2025-10-29T21:23:59-07:00,1,40
styles.css,328,css,ae883871,AHayslip23,10/29/2025,22:06:47,-07:00,2025-10-29T22:06:47-07:00,1,8
styles.css,329,css,871f0dd3,AHayslip23,10/28/2025,21:41:10,-07:00,2025-10-28T21:41:10-07:00,0,0
styles.css,330,css,871f0dd3,AHayslip23,10/28/2025,21:41:10,-07:00,2025-10-28T21:41:10-07:00,0,0
styles.css,331,css,871f0dd3,AHayslip23,10/28/2025,21:41:10,-07:00,2025-10-28T21:41:10-07:00,0,10
styles.css,332,css,871f0dd3,AHayslip23,10/28/2025,21:41:10,-07:00,2025-10-28T21:41:10-07:00,1,12
styles.css,333,css,871f0dd3,AHayslip23,10/28/2025,21:41:10,-07:00,2025-10-28T21:41:10-07:00,1,18
styles.css,334,css,871f0dd3,AHayslip23,10/28/2025,21:41:10,-07:00,2025-10-28T21:41:10-07:00,1,10
styles.css,335,css,871f0dd3,AHayslip23,10/28/2025,21:41:10,-07:00,2025-10-28T21:41:10-07:00,1,16
styles.css,336,css,871f0dd3,AHayslip23,10/28/2025,21:41:10,-07:00,2025-10-28T21:41:10-07:00,0,0
styles.css,337,css,871f0dd3,AHayslip23,10/28/2025,21:41:10,-07:00,2025-10-28T21:41:10-07:00,0,0
styles.css,338,css,871f0dd3,AHayslip23,10/28/2025,21:41:10,-07:00,2025-10-28T21:41:10-07:00,0,15
styles.css,339,css,c0aff02a,AHayslip23,10/29/2025,21:12:52,-07:00,2025-10-29T21:12:52-07:00,1,20
styles.css,340,css,871f0dd3,AHayslip23,10/28/2025,21:41:10,-07:00,2025-10-28T21:41:10-07:00,1,10
styles.css,341,css,871f0dd3,AHayslip23,10/28/2025,21:41:10,-07:00,2025-10-28T21:41:10-07:00,1,11
styles.css,342,css,c0aff02a,AHayslip23,10/29/2025,21:12:52,-07:00,2025-10-29T21:12:52-07:00,1,21
styles.css,343,css,c0aff02a,AHayslip23,10/29/2025,21:12:52,-07:00,2025-10-29T21:12:52-07:00,1,19
styles.css,344,css,342b5101,AHayslip23,10/29/2025,20:35:58,-07:00,2025-10-29T20:35:58-07:00,0,0
styles.css,345,css,342b5101,AHayslip23,10/29/2025,20:35:58,-07:00,2025-10-29T20:35:58-07:00,0,0
styles.css,346,css,342b5101,AHayslip23,10/29/2025,20:35:58,-07:00,2025-10-29T20:35:58-07:00,0,10
styles.css,347,css,342b5101,AHayslip23,10/29/2025,20:35:58,-07:00,2025-10-29T20:35:58-07:00,1,13
styles.css,348,css,c82e8bf2,AHayslip23,10/29/2025,20:39:50,-07:00,2025-10-29T20:39:50-07:00,1,17
styles.css,349,css,c82e8bf2,AHayslip23,10/29/2025,20:39:50,-07:00,2025-10-29T20:39:50-07:00,1,10
styles.css,350,css,342b5101,AHayslip23,10/29/2025,20:35:58,-07:00,2025-10-29T20:35:58-07:00,1,18
styles.css,351,css,342b5101,AHayslip23,10/29/2025,20:35:58,-07:00,2025-10-29T20:35:58-07:00,1,19
styles.css,352,css,c82e8bf2,AHayslip23,10/29/2025,20:39:50,-07:00,2025-10-29T20:39:50-07:00,1,9
styles.css,353,css,c82e8bf2,AHayslip23,10/29/2025,20:39:50,-07:00,2025-10-29T20:39:50-07:00,1,15
styles.css,354,css,342b5101,AHayslip23,10/29/2025,20:35:58,-07:00,2025-10-29T20:35:58-07:00,1,14
styles.css,355,css,342b5101,AHayslip23,10/29/2025,20:35:58,-07:00,2025-10-29T20:35:58-07:00,1,20
styles.css,356,css,342b5101,AHayslip23,10/29/2025,20:35:58,-07:00,2025-10-29T20:35:58-07:00,1,34
styles.css,357,css,c82e8bf2,AHayslip23,10/29/2025,20:39:50,-07:00,2025-10-29T20:39:50-07:00,1,22
styles.css,358,css,c82e8bf2,AHayslip23,10/29/2025,20:39:50,-07:00,2025-10-29T20:39:50-07:00,1,11
styles.css,359,css,c82e8bf2,AHayslip23,10/29/2025,20:39:50,-07:00,2025-10-29T20:39:50-07:00,0,0
styles.css,360,css,c82e8bf2,AHayslip23,10/29/2025,20:39:50,-07:00,2025-10-29T20:39:50-07:00,0,0
styles.css,361,css,c82e8bf2,AHayslip23,10/29/2025,20:39:50,-07:00,2025-10-29T20:39:50-07:00,0,9
styles.css,362,css,7b379cf0,AHayslip23,10/29/2025,21:56:41,-07:00,2025-10-29T21:56:41-07:00,1,12
styles.css,363,css,7b379cf0,AHayslip23,10/29/2025,21:56:41,-07:00,2025-10-29T21:56:41-07:00,1,36
styles.css,364,css,7b379cf0,AHayslip23,10/29/2025,21:56:41,-07:00,2025-10-29T21:56:41-07:00,1,8
styles.css,365,css,7b379cf0,AHayslip23,10/29/2025,21:56:41,-07:00,2025-10-29T21:56:41-07:00,1,20
styles.css,366,css,7b379cf0,AHayslip23,10/29/2025,21:56:41,-07:00,2025-10-29T21:56:41-07:00,1,23
styles.css,367,css,7b379cf0,AHayslip23,10/29/2025,21:56:41,-07:00,2025-10-29T21:56:41-07:00,1,16
styles.css,368,css,e16262b4,AHayslip23,10/29/2025,20:52:10,-07:00,2025-10-29T20:52:10-07:00,0,0
styles.css,369,css,e16262b4,AHayslip23,10/29/2025,20:52:10,-07:00,2025-10-29T20:52:10-07:00,0,0
styles.css,370,css,e16262b4,AHayslip23,10/29/2025,20:52:10,-07:00,2025-10-29T20:52:10-07:00,0,9
styles.css,371,css,e16262b4,AHayslip23,10/29/2025,20:52:10,-07:00,2025-10-29T20:52:10-07:00,1,35
styles.css,372,css,e16262b4,AHayslip23,10/29/2025,20:52:10,-07:00,2025-10-29T20:52:10-07:00,0,0
styles.css,373,css,e16262b4,AHayslip23,10/29/2025,20:52:10,-07:00,2025-10-29T20:52:10-07:00,0,0
styles.css,374,css,e16262b4,AHayslip23,10/29/2025,20:52:10,-07:00,2025-10-29T20:52:10-07:00,0,18
styles.css,375,css,e16262b4,AHayslip23,10/29/2025,20:52:10,-07:00,2025-10-29T20:52:10-07:00,1,17
styles.css,376,css,e16262b4,AHayslip23,10/29/2025,20:52:10,-07:00,2025-10-29T20:52:10-07:00,0,0
styles.css,377,css,e16262b4,AHayslip23,10/29/2025,20:52:10,-07:00,2025-10-29T20:52:10-07:00,0,0
styles.css,378,css,e16262b4,AHayslip23,10/29/2025,20:52:10,-07:00,2025-10-29T20:52:10-07:00,0,16
styles.css,379,css,e16262b4,AHayslip23,10/29/2025,20:52:10,-07:00,2025-10-29T20:52:10-07:00,1,16
styles.css,380,css,e16262b4,AHayslip23,10/29/2025,20:52:10,-07:00,2025-10-29T20:52:10-07:00,1,18
styles.css,381,css,e16262b4,AHayslip23,10/29/2025,20:52:10,-07:00,2025-10-29T20:52:10-07:00,0,0
styles.css,382,css,5a7db5ef,AHayslip23,10/29/2025,21:28:43,-07:00,2025-10-29T21:28:43-07:00,0,0
styles.css,383,css,5a7db5ef,AHayslip23,10/29/2025,21:28:43,-07:00,2025-10-29T21:28:43-07:00,0,25
styles.css,384,css,5a7db5ef,AHayslip23,10/29/2025,21:28:43,-07:00,2025-10-29T21:28:43-07:00,1,14
styles.css,385,css,5a7db5ef,AHayslip23,10/29/2025,21:28:43,-07:00,2025-10-29T21:28:43-07:00,2,21
styles.css,386,css,5a7db5ef,AHayslip23,10/29/2025,21:28:43,-07:00,2025-10-29T21:28:43-07:00,2,18
styles.css,387,css,5a7db5ef,AHayslip23,10/29/2025,21:28:43,-07:00,2025-10-29T21:28:43-07:00,2,10
styles.css,388,css,5a7db5ef,AHayslip23,10/29/2025,21:28:43,-07:00,2025-10-29T21:28:43-07:00,1,0
styles.css,389,css,5a7db5ef,AHayslip23,10/29/2025,21:28:43,-07:00,2025-10-29T21:28:43-07:00,0,0
styles.css,390,css,c1436ef4,AHayslip23,10/29/2025,21:46:36,-07:00,2025-10-29T21:46:36-07:00,0,0
styles.css,391,css,c1436ef4,AHayslip23,10/29/2025,21:46:36,-07:00,2025-10-29T21:46:36-07:00,0,15
styles.css,392,css,c1436ef4,AHayslip23,10/29/2025,21:46:36,-07:00,2025-10-29T21:46:36-07:00,1,17
styles.css,393,css,7b379cf0,AHayslip23,10/29/2025,21:56:41,-07:00,2025-10-29T21:56:41-07:00,1,16
styles.css,394,css,7b379cf0,AHayslip23,10/29/2025,21:56:41,-07:00,2025-10-29T21:56:41-07:00,1,15
styles.css,395,css,7b379cf0,AHayslip23,10/29/2025,21:56:41,-07:00,2025-10-29T21:56:41-07:00,1,18
styles.css,396,css,7b379cf0,AHayslip23,10/29/2025,21:56:41,-07:00,2025-10-29T21:56:41-07:00,1,15
styles.css,397,css,c1436ef4,AHayslip23,10/29/2025,21:46:36,-07:00,2025-10-29T21:46:36-07:00,0,0
styles.css,398,css,7b379cf0,AHayslip23,10/29/2025,21:56:41,-07:00,2025-10-29T21:56:41-07:00,0,0
styles.css,399,css,ae883871,AHayslip23,10/29/2025,22:06:47,-07:00,2025-10-29T22:06:47-07:00,0,18
styles.css,400,css,ae883871,AHayslip23,10/29/2025,22:06:47,-07:00,2025-10-29T22:06:47-07:00,1,13
styles.css,401,css,ae883871,AHayslip23,10/29/2025,22:06:47,-07:00,2025-10-29T22:06:47-07:00,1,11
styles.css,402,css,ae883871,AHayslip23,10/29/2025,22:06:47,-07:00,2025-10-29T22:06:47-07:00,1,12
styles.css,403,css,ae883871,AHayslip23,10/29/2025,22:06:47,-07:00,2025-10-29T22:06:47-07:00,1,13
styles.css,404,css,ae883871,AHayslip23,10/29/2025,22:06:47,-07:00,2025-10-29T22:06:47-07:00,1,18
styles.css,405,css,ae883871,AHayslip23,10/29/2025,22:06:47,-07:00,2025-10-29T22:06:47-07:00,0,0
styles.css,406,css,6dedb6fd,AHayslip23,10/29/2025,22:03:19,-07:00,2025-10-29T22:03:19-07:00,0,0
styles.css,407,css,6dedb6fd,AHayslip23,10/29/2025,22:03:19,-07:00,2025-10-29T22:03:19-07:00,1,7
styles.css,408,css,6dedb6fd,AHayslip23,10/29/2025,22:03:19,-07:00,2025-10-29T22:03:19-07:00,2,9
styles.css,409,css,6dedb6fd,AHayslip23,10/29/2025,22:03:19,-07:00,2025-10-29T22:03:19-07:00,2,13
styles.css,410,css,6dedb6fd,AHayslip23,10/29/2025,22:03:19,-07:00,2025-10-29T22:03:19-07:00,2,36
styles.css,411,css,6dedb6fd,AHayslip23,10/29/2025,22:03:19,-07:00,2025-10-29T22:03:19-07:00,1,0
styles.css,412,css,4bc3dad7,AHayslip23,11/2/2025,10:27:05,-08:00,2025-11-02T10:27:05-08:00,0,0
styles.css,413,css,4bc3dad7,AHayslip23,11/2/2025,10:27:05,-08:00,2025-11-02T10:27:05-08:00,1,6
styles.css,414,css,4bc3dad7,AHayslip23,11/2/2025,10:27:05,-08:00,2025-11-02T10:27:05-08:00,1,12
styles.css,415,css,4bc3dad7,AHayslip23,11/2/2025,10:27:05,-08:00,2025-11-02T10:27:05-08:00,1,30
styles.css,416,css,4bc3dad7,AHayslip23,11/2/2025,10:27:05,-08:00,2025-11-02T10:27:05-08:00,1,16
styles.css,417,css,4bc3dad7,AHayslip23,11/2/2025,10:27:05,-08:00,2025-11-02T10:27:05-08:00,1,33
styles.css,418,css,4bc3dad7,AHayslip23,11/2/2025,10:27:05,-08:00,2025-11-02T10:27:05-08:00,1,14
styles.css,419,css,4bc3dad7,AHayslip23,11/2/2025,10:27:05,-08:00,2025-11-02T10:27:05-08:00,1,15
styles.css,420,css,4bc3dad7,AHayslip23,11/2/2025,10:27:05,-08:00,2025-11-02T10:27:05-08:00,1,15
styles.css,421,css,4bc3dad7,AHayslip23,11/2/2025,10:27:05,-08:00,2025-11-02T10:27:05-08:00,0,0
styles.css,422,css,4bc3dad7,AHayslip23,11/2/2025,10:27:05,-08:00,2025-11-02T10:27:05-08:00,0,0
styles.css,423,css,4bc3dad7,AHayslip23,11/2/2025,10:27:05,-08:00,2025-11-02T10:27:05-08:00,0,9
styles.css,424,css,4bc3dad7,AHayslip23,11/2/2025,10:27:05,-08:00,2025-11-02T10:27:05-08:00,1,16
styles.css,425,css,4bc3dad7,AHayslip23,11/2/2025,10:27:05,-08:00,2025-11-02T10:27:05-08:00,1,10
styles.css,426,css,4bc3dad7,AHayslip23,11/2/2025,10:27:05,-08:00,2025-11-02T10:27:05-08:00,0,0
styles.css,427,css,4bc3dad7,AHayslip23,11/2/2025,10:27:05,-08:00,2025-11-02T10:27:05-08:00,0,0
styles.css,428,css,4bc3dad7,AHayslip23,11/2/2025,10:27:05,-08:00,2025-11-02T10:27:05-08:00,0,9
styles.css,429,css,4bc3dad7,AHayslip23,11/2/2025,10:27:05,-08:00,2025-11-02T10:27:05-08:00,1,8
styles.css,430,css,4bc3dad7,AHayslip23,11/2/2025,10:27:05,-08:00,2025-11-02T10:27:05-08:00,1,16
styles.css,431,css,4bc3dad7,AHayslip23,11/2/2025,10:27:05,-08:00,2025-11-02T10:27:05-08:00,1,10
styles.css,432,css,4bc3dad7,AHayslip23,11/2/2025,10:27:05,-08:00,2025-11-02T10:27:05-08:00,0,0
styles.css,433,css,e12566ac,AHayslip23,11/3/2025,19:58:26,-08:00,2025-11-03T19:58:26-08:00,0,0
styles.css,434,css,e12566ac,AHayslip23,11/3/2025,19:58:26,-08:00,2025-11-03T19:58:26-08:00,0,15
styles.css,435,css,e12566ac,AHayslip23,11/3/2025,19:58:26,-08:00,2025-11-03T19:58:26-08:00,1,11
styles.css,436,css,e12566ac,AHayslip23,11/3/2025,19:58:26,-08:00,2025-11-03T19:58:26-08:00,1,18
styles.css,437,css,e12566ac,AHayslip23,11/3/2025,19:58:26,-08:00,2025-11-03T19:58:26-08:00,0,0
styles.css,438,css,e12566ac,AHayslip23,11/3/2025,19:58:26,-08:00,2025-11-03T19:58:26-08:00,0,0
styles.css,439,css,2af78d8f,AHayslip23,11/3/2025,20:34:23,-08:00,2025-11-03T20:34:23-08:00,0,15
styles.css,440,css,2af78d8f,AHayslip23,11/3/2025,20:34:23,-08:00,2025-11-03T20:34:23-08:00,1,14
styles.css,441,css,2af78d8f,AHayslip23,11/3/2025,20:34:23,-08:00,2025-11-03T20:34:23-08:00,0,0
styles.css,442,css,2af78d8f,AHayslip23,11/3/2025,20:34:23,-08:00,2025-11-03T20:34:23-08:00,0,0
styles.css,443,css,2af78d8f,AHayslip23,11/3/2025,20:34:23,-08:00,2025-11-03T20:34:23-08:00,0,7
styles.css,444,css,2af78d8f,AHayslip23,11/3/2025,20:34:23,-08:00,2025-11-03T20:34:23-08:00,1,12
styles.css,445,css,2af78d8f,AHayslip23,11/3/2025,20:34:23,-08:00,2025-11-03T20:34:23-08:00,1,37
styles.css,446,css,2af78d8f,AHayslip23,11/3/2025,20:34:23,-08:00,2025-11-03T20:34:23-08:00,1,14
styles.css,447,css,2af78d8f,AHayslip23,11/3/2025,20:34:23,-08:00,2025-11-03T20:34:23-08:00,1,8
styles.css,448,css,2af78d8f,AHayslip23,11/3/2025,20:34:23,-08:00,2025-11-03T20:34:23-08:00,0,0
styles.css,449,css,2af78d8f,AHayslip23,11/3/2025,20:34:23,-08:00,2025-11-03T20:34:23-08:00,0,0
styles.css,450,css,2af78d8f,AHayslip23,11/3/2025,20:34:23,-08:00,2025-11-03T20:34:23-08:00,0,10
styles.css,451,css,2af78d8f,AHayslip23,11/3/2025,20:34:23,-08:00,2025-11-03T20:34:23-08:00,1,10
styles.css,452,css,2af78d8f,AHayslip23,11/3/2025,20:34:23,-08:00,2025-11-03T20:34:23-08:00,1,15
styles.css,453,css,2af78d8f,AHayslip23,11/3/2025,20:34:23,-08:00,2025-11-03T20:34:23-08:00,0,0
styles.css,454,css,2af78d8f,AHayslip23,11/3/2025,20:34:23,-08:00,2025-11-03T20:34:23-08:00,0,0
styles.css,455,css,2af78d8f,AHayslip23,11/3/2025,20:34:23,-08:00,2025-11-03T20:34:23-08:00,0,10
styles.css,456,css,2af78d8f,AHayslip23,11/3/2025,20:34:23,-08:00,2025-11-03T20:34:23-08:00,1,8
styles.css,457,css,2af78d8f,AHayslip23,11/3/2025,20:34:23,-08:00,2025-11-03T20:34:23-08:00,1,15
styles.css,458,css,2af78d8f,AHayslip23,11/3/2025,20:34:23,-08:00,2025-11-03T20:34:23-08:00,0,0
styles.css,459,css,2af78d8f,AHayslip23,11/3/2025,20:34:23,-08:00,2025-11-03T20:34:23-08:00,0,0
styles.css,460,css,2af78d8f,AHayslip23,11/3/2025,20:34:23,-08:00,2025-11-03T20:34:23-08:00,0,8
styles.css,461,css,b2fa4064,AHayslip23,11/3/2025,20:49:59,-08:00,2025-11-03T20:49:59-08:00,1,14
styles.css,462,css,b2fa4064,AHayslip23,11/3/2025,20:49:59,-08:00,2025-11-03T20:49:59-08:00,1,19
styles.css,463,css,ec34547c,AHayslip23,11/3/2025,20:42:52,-08:00,2025-11-03T20:42:52-08:00,1,35
styles.css,464,css,ec34547c,AHayslip23,11/3/2025,20:42:52,-08:00,2025-11-03T20:42:52-08:00,1,25
styles.css,465,css,ec34547c,AHayslip23,11/3/2025,20:42:52,-08:00,2025-11-03T20:42:52-08:00,1,36
styles.css,466,css,2af78d8f,AHayslip23,11/3/2025,20:34:23,-08:00,2025-11-03T20:34:23-08:00,1,19
styles.css,467,css,2af78d8f,AHayslip23,11/3/2025,20:34:23,-08:00,2025-11-03T20:34:23-08:00,1,18
styles.css,468,css,ec34547c,AHayslip23,11/3/2025,20:42:52,-08:00,2025-11-03T20:42:52-08:00,1,41
styles.css,469,css,ec34547c,AHayslip23,11/3/2025,20:42:52,-08:00,2025-11-03T20:42:52-08:00,1,12
styles.css,470,css,ec34547c,AHayslip23,11/3/2025,20:42:52,-08:00,2025-11-03T20:42:52-08:00,1,29
styles.css,471,css,b2fa4064,AHayslip23,11/3/2025,20:49:59,-08:00,2025-11-03T20:49:59-08:00,0,0
styles.css,472,css,ec34547c,AHayslip23,11/3/2025,20:42:52,-08:00,2025-11-03T20:42:52-08:00,0,0
styles.css,473,css,ec34547c,AHayslip23,11/3/2025,20:42:52,-08:00,2025-11-03T20:42:52-08:00,0,15
styles.css,474,css,ec34547c,AHayslip23,11/3/2025,20:42:52,-08:00,2025-11-03T20:42:52-08:00,1,12
styles.css,475,css,2af78d8f,AHayslip23,11/3/2025,20:34:23,-08:00,2025-11-03T20:34:23-08:00,0,0
styles.css,476,css,2af78d8f,AHayslip23,11/3/2025,20:34:23,-08:00,2025-11-03T20:34:23-08:00,0,0
styles.css,477,css,2af78d8f,AHayslip23,11/3/2025,20:34:23,-08:00,2025-11-03T20:34:23-08:00,0,6
styles.css,478,css,2af78d8f,AHayslip23,11/3/2025,20:34:23,-08:00,2025-11-03T20:34:23-08:00,1,16
styles.css,479,css,2af78d8f,AHayslip23,11/3/2025,20:34:23,-08:00,2025-11-03T20:34:23-08:00,1,23
styles.css,480,css,2af78d8f,AHayslip23,11/3/2025,20:34:23,-08:00,2025-11-03T20:34:23-08:00,1,22
styles.css,481,css,2af78d8f,AHayslip23,11/3/2025,20:34:23,-08:00,2025-11-03T20:34:23-08:00,0,0
styles.css,482,css,2af78d8f,AHayslip23,11/3/2025,20:34:23,-08:00,2025-11-03T20:34:23-08:00,0,0
styles.css,483,css,2af78d8f,AHayslip23,11/3/2025,20:34:23,-08:00,2025-11-03T20:34:23-08:00,0,12
styles.css,484,css,2af78d8f,AHayslip23,11/3/2025,20:34:23,-08:00,2025-11-03T20:34:23-08:00,1,20
styles.css,485,css,2af78d8f,AHayslip23,11/3/2025,20:34:23,-08:00,2025-11-03T20:34:23-08:00,0,0
styles.css,486,css,ec34547c,AHayslip23,11/3/2025,20:42:52,-08:00,2025-11-03T20:42:52-08:00,0,0
styles.css,487,css,ec34547c,AHayslip23,11/3/2025,20:42:52,-08:00,2025-11-03T20:42:52-08:00,0,7
styles.css,488,css,ec34547c,AHayslip23,11/3/2025,20:42:52,-08:00,2025-11-03T20:42:52-08:00,1,25
styles.css,489,css,ec34547c,AHayslip23,11/3/2025,20:42:52,-08:00,2025-11-03T20:42:52-08:00,1,39
styles.css,490,css,ec34547c,AHayslip23,11/3/2025,20:42:52,-08:00,2025-11-03T20:42:52-08:00,0,0
styles.css,491,css,ec34547c,AHayslip23,11/3/2025,20:42:52,-08:00,2025-11-03T20:42:52-08:00,0,0
styles.css,492,css,ec34547c,AHayslip23,11/3/2025,20:42:52,-08:00,2025-11-03T20:42:52-08:00,0,42
styles.css,493,css,ec34547c,AHayslip23,11/3/2025,20:42:52,-08:00,2025-11-03T20:42:52-08:00,1,9
styles.css,494,css,ec34547c,AHayslip23,11/3/2025,20:42:52,-08:00,2025-11-03T20:42:52-08:00,1,17
styles.css,495,css,ec34547c,AHayslip23,11/3/2025,20:42:52,-08:00,2025-11-03T20:42:52-08:00,0,0
styles.css,496,css,d70d48f1,AHayslip23,11/3/2025,21:29:40,-08:00,2025-11-03T21:29:40-08:00,0,0
styles.css,497,css,d70d48f1,AHayslip23,11/3/2025,21:29:40,-08:00,2025-11-03T21:29:40-08:00,0,15
styles.css,498,css,d70d48f1,AHayslip23,11/3/2025,21:29:40,-08:00,2025-11-03T21:29:40-08:00,1,12
styles.css,499,css,d70d48f1,AHayslip23,11/3/2025,21:29:40,-08:00,2025-11-03T21:29:40-08:00,1,16
styles.css,500,css,d70d48f1,AHayslip23,11/3/2025,21:29:40,-08:00,2025-11-03T21:29:40-08:00,0,0
styles.css,501,css,d70d48f1,AHayslip23,11/3/2025,21:29:40,-08:00,2025-11-03T21:29:40-08:00,0,0
styles.css,502,css,d70d48f1,AHayslip23,11/3/2025,21:29:40,-08:00,2025-11-03T21:29:40-08:00,0,17
styles.css,503,css,d70d48f1,AHayslip23,11/3/2025,21:29:40,-08:00,2025-11-03T21:29:40-08:00,1,12
styles.css,504,css,d70d48f1,AHayslip23,11/3/2025,21:29:40,-08:00,2025-11-03T21:29:40-08:00,1,16
styles.css,505,css,d70d48f1,AHayslip23,11/3/2025,21:29:40,-08:00,2025-11-03T21:29:40-08:00,1,11
styles.css,506,css,d70d48f1,AHayslip23,11/3/2025,21:29:40,-08:00,2025-11-03T21:29:40-08:00,1,18
styles.css,507,css,d70d48f1,AHayslip23,11/3/2025,21:29:40,-08:00,2025-11-03T21:29:40-08:00,0,0
index.js,1,js,0fb6b2fe,AHayslip23,10/19/2025,21:04:19,-07:00,2025-10-19T21:04:19-07:00,0,71
index.js,2,js,0fb6b2fe,AHayslip23,10/19/2025,21:04:19,-07:00,2025-10-19T21:04:19-07:00,0,0
index.js,3,js,0fb6b2fe,AHayslip23,10/19/2025,21:04:19,-07:00,2025-10-19T21:04:19-07:00,0,33
index.js,4,js,0fb6b2fe,AHayslip23,10/19/2025,21:04:19,-07:00,2025-10-19T21:04:19-07:00,1,3
index.js,5,js,0fb6b2fe,AHayslip23,10/19/2025,21:04:19,-07:00,2025-10-19T21:04:19-07:00,2,54
index.js,6,js,0fb6b2fe,AHayslip23,10/19/2025,21:04:19,-07:00,2025-10-19T21:04:19-07:00,2,42
index.js,7,js,0fb6b2fe,AHayslip23,10/19/2025,21:04:19,-07:00,2025-10-19T21:04:19-07:00,2,60
index.js,8,js,0fb6b2fe,AHayslip23,10/19/2025,21:04:19,-07:00,2025-10-19T21:04:19-07:00,0,0
index.js,9,js,0fb6b2fe,AHayslip23,10/19/2025,21:04:19,-07:00,2025-10-19T21:04:19-07:00,2,23
index.js,10,js,0fb6b2fe,AHayslip23,10/19/2025,21:04:19,-07:00,2025-10-19T21:04:19-07:00,3,60
index.js,11,js,0fb6b2fe,AHayslip23,10/19/2025,21:04:19,-07:00,2025-10-19T21:04:19-07:00,3,5
index.js,12,js,bd1a2e30,AHayslip23,10/18/2025,18:42:35,-07:00,2025-10-18T18:42:35-07:00,2,0
index.js,13,js,0fb6b2fe,AHayslip23,10/19/2025,21:04:19,-07:00,2025-10-19T21:04:19-07:00,0,0
index.js,14,js,0fb6b2fe,AHayslip23,10/19/2025,21:04:19,-07:00,2025-10-19T21:04:19-07:00,2,54
index.js,15,js,0fb6b2fe,AHayslip23,10/19/2025,21:04:19,-07:00,2025-10-19T21:04:19-07:00,1,15
index.js,16,js,0fb6b2fe,AHayslip23,10/19/2025,21:04:19,-07:00,2025-10-19T21:04:19-07:00,2,51
index.js,17,js,0fb6b2fe,AHayslip23,10/19/2025,21:04:19,-07:00,2025-10-19T21:04:19-07:00,1,0
index.js,18,js,bd1a2e30,AHayslip23,10/18/2025,18:42:35,-07:00,2025-10-18T18:42:35-07:00,0,0
index.js,19,js,bd1a2e30,AHayslip23,10/18/2025,18:42:35,-07:00,2025-10-18T18:42:35-07:00,0,0
index.js,20,js,bd1a2e30,AHayslip23,10/18/2025,18:42:35,-07:00,2025-10-18T18:42:35-07:00,0,17
index.js,21,js,bd1a2e30,AHayslip23,10/18/2025,18:42:35,-07:00,2025-10-18T18:42:35-07:00,0,0
index.js,22,js,88091d84,AHayslip23,10/19/2025,19:45:28,-07:00,2025-10-19T19:45:28-07:00,0,60
index.js,23,js,88091d84,AHayslip23,10/19/2025,19:45:28,-07:00,2025-10-19T19:45:28-07:00,0,0
index.js,24,js,0fb6b2fe,AHayslip23,10/19/2025,21:04:19,-07:00,2025-10-19T21:04:19-07:00,0,34
index.js,25,js,0fb6b2fe,AHayslip23,10/19/2025,21:04:19,-07:00,2025-10-19T21:04:19-07:00,1,3
index.js,26,js,0fb6b2fe,AHayslip23,10/19/2025,21:04:19,-07:00,2025-10-19T21:04:19-07:00,2,52
index.js,27,js,88091d84,AHayslip23,10/19/2025,19:45:28,-07:00,2025-10-19T19:45:28-07:00,0,0
index.js,28,js,0fb6b2fe,AHayslip23,10/19/2025,21:04:19,-07:00,2025-10-19T21:04:19-07:00,2,18
index.js,29,js,1b4cab09,AHayslip23,10/19/2025,20:24:52,-07:00,2025-10-19T20:24:52-07:00,3,55
index.js,30,js,1b4cab09,AHayslip23,10/19/2025,20:24:52,-07:00,2025-10-19T20:24:52-07:00,3,5
index.js,31,js,1b4cab09,AHayslip23,10/19/2025,20:24:52,-07:00,2025-10-19T20:24:52-07:00,2,0
index.js,32,js,1b4cab09,AHayslip23,10/19/2025,20:24:52,-07:00,2025-10-19T20:24:52-07:00,0,0
index.js,33,js,0fb6b2fe,AHayslip23,10/19/2025,21:04:19,-07:00,2025-10-19T21:04:19-07:00,2,25
index.js,34,js,1b4cab09,AHayslip23,10/19/2025,20:24:52,-07:00,2025-10-19T20:24:52-07:00,3,2
index.js,35,js,1b4cab09,AHayslip23,10/19/2025,20:24:52,-07:00,2025-10-19T20:24:52-07:00,4,55
index.js,36,js,1b4cab09,AHayslip23,10/19/2025,20:24:52,-07:00,2025-10-19T20:24:52-07:00,4,55
index.js,37,js,1b4cab09,AHayslip23,10/19/2025,20:24:52,-07:00,2025-10-19T20:24:52-07:00,4,49
index.js,38,js,1b4cab09,AHayslip23,10/19/2025,20:24:52,-07:00,2025-10-19T20:24:52-07:00,4,49
index.js,39,js,1b4cab09,AHayslip23,10/19/2025,20:24:52,-07:00,2025-10-19T20:24:52-07:00,3,3
index.js,40,js,1b4cab09,AHayslip23,10/19/2025,20:24:52,-07:00,2025-10-19T20:24:52-07:00,2,0
index.js,41,js,1b4cab09,AHayslip23,10/19/2025,20:24:52,-07:00,2025-10-19T20:24:52-07:00,1,15
index.js,42,js,1b4cab09,AHayslip23,10/19/2025,20:24:52,-07:00,2025-10-19T20:24:52-07:00,2,49
index.js,43,js,1b4cab09,AHayslip23,10/19/2025,20:24:52,-07:00,2025-10-19T20:24:52-07:00,2,17
index.js,44,js,1b4cab09,AHayslip23,10/19/2025,20:24:52,-07:00,2025-10-19T20:24:52-07:00,3,80
index.js,45,js,0dcea717,AHayslip23,10/19/2025,20:20:29,-07:00,2025-10-19T20:20:29-07:00,2,0
index.js,46,js,0dcea717,AHayslip23,10/19/2025,20:20:29,-07:00,2025-10-19T20:20:29-07:00,1,0
index.js,47,js,88091d84,AHayslip23,10/19/2025,19:45:28,-07:00,2025-10-19T19:45:28-07:00,0,0
index.js,48,js,397565f7,AHayslip23,10/18/2025,18:31:06,-07:00,2025-10-18T18:31:06-07:00,0,0
index.js,49,js,0fb6b2fe,AHayslip23,10/19/2025,21:04:19,-07:00,2025-10-19T21:04:19-07:00,0,18
index.js,50,js,397565f7,AHayslip23,10/18/2025,18:31:06,-07:00,2025-10-18T18:31:06-07:00,0,0
index.js,51,js,397565f7,AHayslip23,10/18/2025,18:31:06,-07:00,2025-10-18T18:31:06-07:00,0,0
index.html,1,html,98c0aa59,AHayslip23,9/29/2025,23:16:37,-07:00,2025-09-29T23:16:37-07:00,0,13
index.html,2,html,98c0aa59,AHayslip23,9/29/2025,23:16:37,-07:00,2025-09-29T23:16:37-07:00,0,14
index.html,3,html,98c0aa59,AHayslip23,9/29/2025,23:16:37,-07:00,2025-09-29T23:16:37-07:00,0,4
index.html,4,html,98c0aa59,AHayslip23,9/29/2025,23:16:37,-07:00,2025-09-29T23:16:37-07:00,2,20
index.html,5,html,98c0aa59,AHayslip23,9/29/2025,23:16:37,-07:00,2025-09-29T23:16:37-07:00,2,68
index.html,6,html,98c0aa59,AHayslip23,9/29/2025,23:16:37,-07:00,2025-09-29T23:16:37-07:00,2,54
index.html,7,html,452be9c2,AHayslip23,10/3/2025,22:11:56,-07:00,2025-10-03T22:11:56-07:00,2,39
index.html,8,html,98c0aa59,AHayslip23,9/29/2025,23:16:37,-07:00,2025-09-29T23:16:37-07:00,0,5
index.html,9,html,98c0aa59,AHayslip23,9/29/2025,23:16:37,-07:00,2025-09-29T23:16:37-07:00,0,4
index.html,10,html,e5c81f28,AHayslip23,10/18/2025,18:21:59,-07:00,2025-10-18T18:21:59-07:00,0,0
index.html,11,html,7a3279ce,AHayslip23,10/19/2025,20:00:09,-07:00,2025-10-19T20:00:09-07:00,0,22
index.html,12,html,0dcea717,AHayslip23,10/19/2025,20:20:29,-07:00,2025-10-19T20:20:29-07:00,1,42
index.html,13,html,7a3279ce,AHayslip23,10/19/2025,20:00:09,-07:00,2025-10-19T20:00:09-07:00,0,4
index.html,14,html,7a3279ce,AHayslip23,10/19/2025,20:00:09,-07:00,2025-10-19T20:00:09-07:00,0,0
index.html,15,html,b5d0baf5,AHayslip23,10/19/2025,20:13:19,-07:00,2025-10-19T20:13:19-07:00,0,19
index.html,16,html,b5d0baf5,AHayslip23,10/19/2025,20:13:19,-07:00,2025-10-19T20:13:19-07:00,0,367
index.html,17,html,b5d0baf5,AHayslip23,10/19/2025,20:13:19,-07:00,2025-10-19T20:13:19-07:00,0,122
index.html,18,html,b5d0baf5,AHayslip23,10/19/2025,20:13:19,-07:00,2025-10-19T20:13:19-07:00,0,0
index.html,19,html,61af7d87,AHayslip23,10/14/2025,18:05:42,-07:00,2025-10-14T18:05:42-07:00,0,45
index.html,20,html,6abce493,AHayslip23,10/19/2025,20:41:11,-07:00,2025-10-19T20:41:11-07:00,0,44
index.html,21,html,98c0aa59,AHayslip23,9/29/2025,23:16:37,-07:00,2025-09-29T23:16:37-07:00,0,5
index.html,22,html,98c0aa59,AHayslip23,9/29/2025,23:16:37,-07:00,2025-09-29T23:16:37-07:00,0,5
global.js,1,js,53f02fe5,AHayslip23,10/14/2025,18:53:41,-07:00,2025-10-14T18:53:41-07:00,0,25
global.js,2,js,b39f0c0d,AHayslip23,10/14/2025,17:54:39,-07:00,2025-10-14T17:54:39-07:00,0,0
global.js,3,js,5c8cc30b,AHayslip23,10/14/2025,18:49:21,-07:00,2025-10-14T18:49:21-07:00,0,41
global.js,4,js,5c8cc30b,AHayslip23,10/14/2025,18:49:21,-07:00,2025-10-14T18:49:21-07:00,1,52
global.js,5,js,5c8cc30b,AHayslip23,10/14/2025,18:49:21,-07:00,2025-10-14T18:49:21-07:00,0,0
global.js,6,js,4fae6826,AHayslip23,10/14/2025,18:19:25,-07:00,2025-10-14T18:19:25-07:00,0,0
global.js,7,js,f34ac474,AHayslip23,11/19/2025,22:09:22,-08:00,2025-11-19T22:09:22-08:00,0,15
global.js,8,js,f34ac474,AHayslip23,11/19/2025,22:09:22,-08:00,2025-11-19T22:09:22-08:00,1,68
global.js,9,js,f34ac474,AHayslip23,11/19/2025,22:09:22,-08:00,2025-11-19T22:09:22-08:00,2,3
global.js,10,js,f34ac474,AHayslip23,11/19/2025,22:09:22,-08:00,2025-11-19T22:09:22-08:00,2,14
global.js,11,js,f34ac474,AHayslip23,11/19/2025,22:09:22,-08:00,2025-11-19T22:09:22-08:00,0,0
global.js,12,js,5c8cc30b,AHayslip23,10/14/2025,18:49:21,-07:00,2025-10-14T18:49:21-07:00,0,11
global.js,13,js,c88bb41c,AHayslip23,10/28/2025,21:05:51,-07:00,2025-10-28T21:05:51-07:00,1,30
global.js,14,js,c88bb41c,AHayslip23,10/28/2025,21:05:51,-07:00,2025-10-28T21:05:51-07:00,1,47
global.js,15,js,c88bb41c,AHayslip23,10/28/2025,21:05:51,-07:00,2025-10-28T21:05:51-07:00,1,48
global.js,16,js,c88bb41c,AHayslip23,10/28/2025,21:05:51,-07:00,2025-10-28T21:05:51-07:00,1,63
global.js,17,js,5f52c90b,AHayslip23,11/2/2025,9:29:26,-08:00,2025-11-02T09:29:26-08:00,1,27
global.js,18,js,5f52c90b,AHayslip23,11/2/2025,9:29:26,-08:00,2025-11-02T09:29:26-08:00,1,35
global.js,19,js,5c8cc30b,AHayslip23,10/14/2025,18:49:21,-07:00,2025-10-14T18:49:21-07:00,0,0
global.js,20,js,4fae6826,AHayslip23,10/14/2025,18:19:25,-07:00,2025-10-14T18:19:25-07:00,0,0
global.js,21,js,5bc586a9,AHayslip23,10/14/2025,19:08:31,-07:00,2025-10-14T19:08:31-07:00,0,38
global.js,22,js,5c8cc30b,AHayslip23,10/14/2025,18:49:21,-07:00,2025-10-14T18:49:21-07:00,0,25
global.js,23,js,5c8cc30b,AHayslip23,10/14/2025,18:49:21,-07:00,2025-10-14T18:49:21-07:00,0,0
global.js,24,js,5c8cc30b,AHayslip23,10/14/2025,18:49:21,-07:00,2025-10-14T18:49:21-07:00,0,20
global.js,25,js,763577c3,AHayslip23,10/20/2025,20:33:49,-07:00,2025-10-20T20:33:49-07:00,1,36
global.js,26,js,763577c3,AHayslip23,10/20/2025,20:33:49,-07:00,2025-10-20T20:33:49-07:00,2,45
global.js,27,js,763577c3,AHayslip23,10/20/2025,20:33:49,-07:00,2025-10-20T20:33:49-07:00,2,33
global.js,28,js,763577c3,AHayslip23,10/20/2025,20:33:49,-07:00,2025-10-20T20:33:49-07:00,0,0
global.js,29,js,763577c3,AHayslip23,10/20/2025,20:33:49,-07:00,2025-10-20T20:33:49-07:00,2,46
global.js,30,js,763577c3,AHayslip23,10/20/2025,20:33:49,-07:00,2025-10-20T20:33:49-07:00,2,30
global.js,31,js,763577c3,AHayslip23,10/20/2025,20:33:49,-07:00,2025-10-20T20:33:49-07:00,2,41
global.js,32,js,763577c3,AHayslip23,10/20/2025,20:33:49,-07:00,2025-10-20T20:33:49-07:00,2,22
global.js,33,js,763577c3,AHayslip23,10/20/2025,20:33:49,-07:00,2025-10-20T20:33:49-07:00,0,0
global.js,34,js,763577c3,AHayslip23,10/20/2025,20:33:49,-07:00,2025-10-20T20:33:49-07:00,2,52
global.js,35,js,763577c3,AHayslip23,10/20/2025,20:33:49,-07:00,2025-10-20T20:33:49-07:00,2,48
global.js,36,js,763577c3,AHayslip23,10/20/2025,20:33:49,-07:00,2025-10-20T20:33:49-07:00,0,0
global.js,37,js,c88bb41c,AHayslip23,10/28/2025,21:05:51,-07:00,2025-10-28T21:05:51-07:00,2,16
global.js,38,js,763577c3,AHayslip23,10/20/2025,20:33:49,-07:00,2025-10-20T20:33:49-07:00,3,52
global.js,39,js,763577c3,AHayslip23,10/20/2025,20:33:49,-07:00,2025-10-20T20:33:49-07:00,3,52
global.js,40,js,763577c3,AHayslip23,10/20/2025,20:33:49,-07:00,2025-10-20T20:33:49-07:00,3,52
global.js,41,js,763577c3,AHayslip23,10/20/2025,20:33:49,-07:00,2025-10-20T20:33:49-07:00,3,52
global.js,42,js,c88bb41c,AHayslip23,10/28/2025,21:05:51,-07:00,2025-10-28T21:05:51-07:00,3,52
global.js,43,js,763577c3,AHayslip23,10/20/2025,20:33:49,-07:00,2025-10-20T20:33:49-07:00,2,0
global.js,44,js,763577c3,AHayslip23,10/20/2025,20:33:49,-07:00,2025-10-20T20:33:49-07:00,0,0
global.js,45,js,763577c3,AHayslip23,10/20/2025,20:33:49,-07:00,2025-10-20T20:33:49-07:00,2,24
global.js,46,js,763577c3,AHayslip23,10/20/2025,20:33:49,-07:00,2025-10-20T20:33:49-07:00,3,39
global.js,47,js,763577c3,AHayslip23,10/20/2025,20:33:49,-07:00,2025-10-20T20:33:49-07:00,3,29
global.js,48,js,763577c3,AHayslip23,10/20/2025,20:33:49,-07:00,2025-10-20T20:33:49-07:00,3,26
global.js,49,js,763577c3,AHayslip23,10/20/2025,20:33:49,-07:00,2025-10-20T20:33:49-07:00,3,27
global.js,50,js,763577c3,AHayslip23,10/20/2025,20:33:49,-07:00,2025-10-20T20:33:49-07:00,2,0
global.js,51,js,763577c3,AHayslip23,10/20/2025,20:33:49,-07:00,2025-10-20T20:33:49-07:00,0,0
global.js,52,js,763577c3,AHayslip23,10/20/2025,20:33:49,-07:00,2025-10-20T20:33:49-07:00,2,31
global.js,53,js,763577c3,AHayslip23,10/20/2025,20:33:49,-07:00,2025-10-20T20:33:49-07:00,2,19
global.js,54,js,763577c3,AHayslip23,10/20/2025,20:33:49,-07:00,2025-10-20T20:33:49-07:00,0,0
global.js,55,js,c88bb41c,AHayslip23,10/28/2025,21:05:51,-07:00,2025-10-28T21:05:51-07:00,1,6
global.js,56,js,763577c3,AHayslip23,10/20/2025,20:33:49,-07:00,2025-10-20T20:33:49-07:00,2,62
global.js,57,js,763577c3,AHayslip23,10/20/2025,20:33:49,-07:00,2025-10-20T20:33:49-07:00,2,34
global.js,58,js,763577c3,AHayslip23,10/20/2025,20:33:49,-07:00,2025-10-20T20:33:49-07:00,2,11
global.js,59,js,763577c3,AHayslip23,10/20/2025,20:33:49,-07:00,2025-10-20T20:33:49-07:00,2,22
global.js,60,js,763577c3,AHayslip23,10/20/2025,20:33:49,-07:00,2025-10-20T20:33:49-07:00,0,0
global.js,61,js,763577c3,AHayslip23,10/20/2025,20:33:49,-07:00,2025-10-20T20:33:49-07:00,2,17
global.js,62,js,763577c3,AHayslip23,10/20/2025,20:33:49,-07:00,2025-10-20T20:33:49-07:00,3,8
global.js,63,js,763577c3,AHayslip23,10/20/2025,20:33:49,-07:00,2025-10-20T20:33:49-07:00,3,58
global.js,64,js,763577c3,AHayslip23,10/20/2025,20:33:49,-07:00,2025-10-20T20:33:49-07:00,2,0
global.js,65,js,763577c3,AHayslip23,10/20/2025,20:33:49,-07:00,2025-10-20T20:33:49-07:00,0,0
global.js,66,js,763577c3,AHayslip23,10/20/2025,20:33:49,-07:00,2025-10-20T20:33:49-07:00,2,52
global.js,67,js,763577c3,AHayslip23,10/20/2025,20:33:49,-07:00,2025-10-20T20:33:49-07:00,2,12
global.js,68,js,763577c3,AHayslip23,10/20/2025,20:33:49,-07:00,2025-10-20T20:33:49-07:00,1,0
global.js,69,js,53f02fe5,AHayslip23,10/14/2025,18:53:41,-07:00,2025-10-14T18:53:41-07:00,0,0
global.js,70,js,3e36360c,AHayslip23,10/14/2025,20:19:13,-07:00,2025-10-14T20:19:13-07:00,0,0
global.js,71,js,3e36360c,AHayslip23,10/14/2025,20:19:13,-07:00,2025-10-14T20:19:13-07:00,0,31
global.js,72,js,3e36360c,AHayslip23,10/14/2025,20:19:13,-07:00,2025-10-14T20:19:13-07:00,1,11
global.js,73,js,3e36360c,AHayslip23,10/14/2025,20:19:13,-07:00,2025-10-14T20:19:13-07:00,1,0
global.js,74,js,3e36360c,AHayslip23,10/14/2025,20:19:13,-07:00,2025-10-14T20:19:13-07:00,1,26
global.js,75,js,3e36360c,AHayslip23,10/14/2025,20:19:13,-07:00,2025-10-14T20:19:13-07:00,2,4
global.js,76,js,3e36360c,AHayslip23,10/14/2025,20:19:13,-07:00,2025-10-14T20:19:13-07:00,2,24
global.js,77,js,3e36360c,AHayslip23,10/14/2025,20:19:13,-07:00,2025-10-14T20:19:13-07:00,3,43
global.js,78,js,3e36360c,AHayslip23,10/14/2025,20:19:13,-07:00,2025-10-14T20:19:13-07:00,3,34
global.js,79,js,3e36360c,AHayslip23,10/14/2025,20:19:13,-07:00,2025-10-14T20:19:13-07:00,3,32
global.js,80,js,3e36360c,AHayslip23,10/14/2025,20:19:13,-07:00,2025-10-14T20:19:13-07:00,2,7
global.js,81,js,3e36360c,AHayslip23,10/14/2025,20:19:13,-07:00,2025-10-14T20:19:13-07:00,1,6
global.js,82,js,3e36360c,AHayslip23,10/14/2025,20:19:13,-07:00,2025-10-14T20:19:13-07:00,0,0
global.js,83,js,3e36360c,AHayslip23,10/14/2025,20:19:13,-07:00,2025-10-14T20:19:13-07:00,0,0
global.js,84,js,3e36360c,AHayslip23,10/14/2025,20:19:13,-07:00,2025-10-14T20:19:13-07:00,0,0
global.js,85,js,3e36360c,AHayslip23,10/14/2025,20:19:13,-07:00,2025-10-14T20:19:13-07:00,0,53
global.js,86,js,3e36360c,AHayslip23,10/14/2025,20:19:13,-07:00,2025-10-14T20:19:13-07:00,0,0
global.js,87,js,3e36360c,AHayslip23,10/14/2025,20:19:13,-07:00,2025-10-14T20:19:13-07:00,0,31
global.js,88,js,3e36360c,AHayslip23,10/14/2025,20:19:13,-07:00,2025-10-14T20:19:13-07:00,1,65
global.js,89,js,3e36360c,AHayslip23,10/14/2025,20:19:13,-07:00,2025-10-14T20:19:13-07:00,1,32
global.js,90,js,3e36360c,AHayslip23,10/14/2025,20:19:13,-07:00,2025-10-14T20:19:13-07:00,1,20
global.js,91,js,3e36360c,AHayslip23,10/14/2025,20:19:13,-07:00,2025-10-14T20:19:13-07:00,0,0
global.js,92,js,3e36360c,AHayslip23,10/14/2025,20:19:13,-07:00,2025-10-14T20:19:13-07:00,0,0
global.js,93,js,3e36360c,AHayslip23,10/14/2025,20:19:13,-07:00,2025-10-14T20:19:13-07:00,0,34
global.js,94,js,3e36360c,AHayslip23,10/14/2025,20:19:13,-07:00,2025-10-14T20:19:13-07:00,1,39
global.js,95,js,3e36360c,AHayslip23,10/14/2025,20:19:13,-07:00,2025-10-14T20:19:13-07:00,0,0
global.js,96,js,3e36360c,AHayslip23,10/14/2025,20:19:13,-07:00,2025-10-14T20:19:13-07:00,0,0
global.js,97,js,3e36360c,AHayslip23,10/14/2025,20:19:13,-07:00,2025-10-14T20:19:13-07:00,0,43
global.js,98,js,3e36360c,AHayslip23,10/14/2025,20:19:13,-07:00,2025-10-14T20:19:13-07:00,1,33
global.js,99,js,a0cecd63,AHayslip23,10/14/2025,20:28:09,-07:00,2025-10-14T20:28:09-07:00,0,1
global.js,100,js,a0cecd63,AHayslip23,10/14/2025,20:28:09,-07:00,2025-10-14T20:28:09-07:00,0,0
global.js,101,js,a0cecd63,AHayslip23,10/14/2025,20:28:09,-07:00,2025-10-14T20:28:09-07:00,0,42
global.js,102,js,a0cecd63,AHayslip23,10/14/2025,20:28:09,-07:00,2025-10-14T20:28:09-07:00,0,0
global.js,103,js,a0cecd63,AHayslip23,10/14/2025,20:28:09,-07:00,2025-10-14T20:28:09-07:00,0,43
global.js,104,js,c88bb41c,AHayslip23,10/28/2025,21:05:51,-07:00,2025-10-28T21:05:51-07:00,1,21
global.js,105,js,a0cecd63,AHayslip23,10/14/2025,20:28:09,-07:00,2025-10-14T20:28:09-07:00,1,30
global.js,106,js,a0cecd63,AHayslip23,10/14/2025,20:28:09,-07:00,2025-10-14T20:28:09-07:00,1,26
global.js,107,js,a0cecd63,AHayslip23,10/14/2025,20:28:09,-07:00,2025-10-14T20:28:09-07:00,1,16
global.js,108,js,a0cecd63,AHayslip23,10/14/2025,20:28:09,-07:00,2025-10-14T20:28:09-07:00,0,0
global.js,109,js,a0cecd63,AHayslip23,10/14/2025,20:28:09,-07:00,2025-10-14T20:28:09-07:00,1,31
global.js,110,js,a0cecd63,AHayslip23,10/14/2025,20:28:09,-07:00,2025-10-14T20:28:09-07:00,2,50
global.js,111,js,a0cecd63,AHayslip23,10/14/2025,20:28:09,-07:00,2025-10-14T20:28:09-07:00,1,0
global.js,112,js,a0cecd63,AHayslip23,10/14/2025,20:28:09,-07:00,2025-10-14T20:28:09-07:00,0,0
global.js,113,js,a0cecd63,AHayslip23,10/14/2025,20:28:09,-07:00,2025-10-14T20:28:09-07:00,1,22
global.js,114,js,a0cecd63,AHayslip23,10/14/2025,20:28:09,-07:00,2025-10-14T20:28:09-07:00,1,18
global.js,115,js,e3796581,AHayslip23,10/18/2025,17:34:25,-07:00,2025-10-18T17:34:25-07:00,0,1
global.js,116,js,e3796581,AHayslip23,10/18/2025,17:34:25,-07:00,2025-10-18T17:34:25-07:00,0,0
global.js,117,js,c88bb41c,AHayslip23,10/28/2025,21:05:51,-07:00,2025-10-28T21:05:51-07:00,0,36
global.js,118,js,c88bb41c,AHayslip23,10/28/2025,21:05:51,-07:00,2025-10-28T21:05:51-07:00,1,3
global.js,119,js,5fee3bb1,AHayslip23,10/18/2025,18:04:12,-07:00,2025-10-18T18:04:12-07:00,2,32
global.js,120,js,5fee3bb1,AHayslip23,10/18/2025,18:04:12,-07:00,2025-10-18T18:04:12-07:00,2,17
global.js,121,js,5fee3bb1,AHayslip23,10/18/2025,18:04:12,-07:00,2025-10-18T18:04:12-07:00,3,66
global.js,122,js,5fee3bb1,AHayslip23,10/18/2025,18:04:12,-07:00,2025-10-18T18:04:12-07:00,2,0
global.js,123,js,c88bb41c,AHayslip23,10/28/2025,21:05:51,-07:00,2025-10-28T21:05:51-07:00,2,27
global.js,124,js,c88bb41c,AHayslip23,10/28/2025,21:05:51,-07:00,2025-10-28T21:05:51-07:00,1,15
global.js,125,js,c88bb41c,AHayslip23,10/28/2025,21:05:51,-07:00,2025-10-28T21:05:51-07:00,2,59
global.js,126,js,5fee3bb1,AHayslip23,10/18/2025,18:04:12,-07:00,2025-10-18T18:04:12-07:00,2,8
global.js,127,js,e3796581,AHayslip23,10/18/2025,17:34:25,-07:00,2025-10-18T17:34:25-07:00,1,0
global.js,128,js,e3796581,AHayslip23,10/18/2025,17:34:25,-07:00,2025-10-18T17:34:25-07:00,0,0
global.js,129,js,e3796581,AHayslip23,10/18/2025,17:34:25,-07:00,2025-10-18T17:34:25-07:00,0,0
global.js,130,js,c88bb41c,AHayslip23,10/28/2025,21:05:51,-07:00,2025-10-28T21:05:51-07:00,0,79
global.js,131,js,c88bb41c,AHayslip23,10/28/2025,21:05:51,-07:00,2025-10-28T21:05:51-07:00,1,28
global.js,132,js,e3796581,AHayslip23,10/18/2025,17:34:25,-07:00,2025-10-18T17:34:25-07:00,0,0
global.js,133,js,c88bb41c,AHayslip23,10/28/2025,21:05:51,-07:00,2025-10-28T21:05:51-07:00,1,30
global.js,134,js,e3796581,AHayslip23,10/18/2025,17:34:25,-07:00,2025-10-18T17:34:25-07:00,0,0
global.js,135,js,c88bb41c,AHayslip23,10/28/2025,21:05:51,-07:00,2025-10-28T21:05:51-07:00,1,21
global.js,136,js,c88bb41c,AHayslip23,10/28/2025,21:05:51,-07:00,2025-10-28T21:05:51-07:00,2,60
global.js,137,js,5fee3bb1,AHayslip23,10/18/2025,18:04:12,-07:00,2025-10-18T18:04:12-07:00,2,5
global.js,138,js,5fee3bb1,AHayslip23,10/18/2025,18:04:12,-07:00,2025-10-18T18:04:12-07:00,1,0
global.js,139,js,e3796581,AHayslip23,10/18/2025,17:34:25,-07:00,2025-10-18T17:34:25-07:00,0,0
global.js,140,js,c88bb41c,AHayslip23,10/28/2025,21:05:51,-07:00,2025-10-28T21:05:51-07:00,1,29
global.js,141,js,c88bb41c,AHayslip23,10/28/2025,21:05:51,-07:00,2025-10-28T21:05:51-07:00,2,48
global.js,142,js,c88bb41c,AHayslip23,10/28/2025,21:05:51,-07:00,2025-10-28T21:05:51-07:00,2,48
global.js,143,js,c88bb41c,AHayslip23,10/28/2025,21:05:51,-07:00,2025-10-28T21:05:51-07:00,2,32
global.js,144,js,c88bb41c,AHayslip23,10/28/2025,21:05:51,-07:00,2025-10-28T21:05:51-07:00,2,44
global.js,145,js,c88bb41c,AHayslip23,10/28/2025,21:05:51,-07:00,2025-10-28T21:05:51-07:00,2,33
global.js,146,js,e0a6285d,AHayslip23,11/10/2025,20:53:41,-08:00,2025-11-10T20:53:41-08:00,2,30
global.js,147,js,e3796581,AHayslip23,10/18/2025,17:34:25,-07:00,2025-10-18T17:34:25-07:00,0,0
global.js,148,js,e0a6285d,AHayslip23,11/10/2025,20:53:41,-08:00,2025-11-10T20:53:41-08:00,2,31
global.js,149,js,5fee3bb1,AHayslip23,10/18/2025,18:04:12,-07:00,2025-10-18T18:04:12-07:00,2,19
global.js,150,js,5fee3bb1,AHayslip23,10/18/2025,18:04:12,-07:00,2025-10-18T18:04:12-07:00,3,41
global.js,151,js,5fee3bb1,AHayslip23,10/18/2025,18:04:12,-07:00,2025-10-18T18:04:12-07:00,3,33
global.js,152,js,c88bb41c,AHayslip23,10/28/2025,21:05:51,-07:00,2025-10-28T21:05:51-07:00,3,24
global.js,153,js,c88bb41c,AHayslip23,10/28/2025,21:05:51,-07:00,2025-10-28T21:05:51-07:00,4,19
global.js,154,js,c88bb41c,AHayslip23,10/28/2025,21:05:51,-07:00,2025-10-28T21:05:51-07:00,4,33
global.js,155,js,e0a6285d,AHayslip23,11/10/2025,20:53:41,-08:00,2025-11-10T20:53:41-08:00,4,0
global.js,156,js,e0a6285d,AHayslip23,11/10/2025,20:53:41,-08:00,2025-11-10T20:53:41-08:00,5,1
global.js,157,js,e0a6285d,AHayslip23,11/10/2025,20:53:41,-08:00,2025-11-10T20:53:41-08:00,6,74
global.js,158,js,e0a6285d,AHayslip23,11/10/2025,20:53:41,-08:00,2025-11-10T20:53:41-08:00,6,2
global.js,159,js,e0a6285d,AHayslip23,11/10/2025,20:53:41,-08:00,2025-11-10T20:53:41-08:00,4,0
global.js,160,js,c88bb41c,AHayslip23,10/28/2025,21:05:51,-07:00,2025-10-28T21:05:51-07:00,3,4
global.js,161,js,14cfda65,AHayslip23,10/18/2025,18:01:19,-07:00,2025-10-18T18:01:19-07:00,2,0
global.js,162,js,e3796581,AHayslip23,10/18/2025,17:34:25,-07:00,2025-10-18T17:34:25-07:00,0,0
global.js,163,js,5fee3bb1,AHayslip23,10/18/2025,18:04:12,-07:00,2025-10-18T18:04:12-07:00,2,36
global.js,164,js,5fee3bb1,AHayslip23,10/18/2025,18:04:12,-07:00,2025-10-18T18:04:12-07:00,1,1
global.js,165,js,88091d84,AHayslip23,10/19/2025,19:45:28,-07:00,2025-10-19T19:45:28-07:00,0,0
global.js,166,js,88091d84,AHayslip23,10/19/2025,19:45:28,-07:00,2025-10-19T19:45:28-07:00,0,0
global.js,167,js,0dcea717,AHayslip23,10/19/2025,20:20:29,-07:00,2025-10-19T20:20:29-07:00,0,47
global.js,168,js,0dcea717,AHayslip23,10/19/2025,20:20:29,-07:00,2025-10-19T20:20:29-07:00,1,71
global.js,169,js,c88bb41c,AHayslip23,10/28/2025,21:05:51,-07:00,2025-10-28T21:05:51-07:00,1,74
global.js,170,js,0dcea717,AHayslip23,10/19/2025,20:20:29,-07:00,2025-10-19T20:20:29-07:00,1,21
global.js,171,js,0b86e2e5,AHayslip23,10/28/2025,20:55:45,-07:00,2025-10-28T20:55:45-07:00,0,0
global.js,172,js,0b86e2e5,AHayslip23,10/28/2025,20:55:45,-07:00,2025-10-28T20:55:45-07:00,0,0
global.js,173,js,0b86e2e5,AHayslip23,10/28/2025,20:55:45,-07:00,2025-10-28T20:55:45-07:00,0,38
global.js,174,js,0b86e2e5,AHayslip23,10/28/2025,20:55:45,-07:00,2025-10-28T20:55:45-07:00,1,6
global.js,175,js,0b86e2e5,AHayslip23,10/28/2025,20:55:45,-07:00,2025-10-28T20:55:45-07:00,2,19
global.js,176,js,0b86e2e5,AHayslip23,10/28/2025,20:55:45,-07:00,2025-10-28T20:55:45-07:00,3,49
global.js,177,js,0b86e2e5,AHayslip23,10/28/2025,20:55:45,-07:00,2025-10-28T20:55:45-07:00,3,24
global.js,178,js,0b86e2e5,AHayslip23,10/28/2025,20:55:45,-07:00,2025-10-28T20:55:45-07:00,4,23
global.js,179,js,0b86e2e5,AHayslip23,10/28/2025,20:55:45,-07:00,2025-10-28T20:55:45-07:00,4,27
global.js,180,js,c88bb41c,AHayslip23,10/28/2025,21:05:51,-07:00,2025-10-28T21:05:51-07:00,4,50
global.js,181,js,0b86e2e5,AHayslip23,10/28/2025,20:55:45,-07:00,2025-10-28T20:55:45-07:00,3,4
global.js,182,js,0b86e2e5,AHayslip23,10/28/2025,20:55:45,-07:00,2025-10-28T20:55:45-07:00,2,4
global.js,183,js,0b86e2e5,AHayslip23,10/28/2025,20:55:45,-07:00,2025-10-28T20:55:45-07:00,1,0
global.js,184,js,5fee3bb1,AHayslip23,10/18/2025,18:04:12,-07:00,2025-10-18T18:04:12-07:00,0,0
global.css,1,css,e90e88d5,AHayslip23,11/18/2025,0:16:39,-08:00,2025-11-18T00:16:39-08:00,0,10
global.css,2,css,e90e88d5,AHayslip23,11/18/2025,0:16:39,-08:00,2025-11-18T00:16:39-08:00,0,10
global.css,3,css,e90e88d5,AHayslip23,11/18/2025,0:16:39,-08:00,2025-11-18T00:16:39-08:00,1,15
global.css,4,css,e90e88d5,AHayslip23,11/18/2025,0:16:39,-08:00,2025-11-18T00:16:39-08:00,1,21
global.css,5,css,e90e88d5,AHayslip23,11/18/2025,0:16:39,-08:00,2025-11-18T00:16:39-08:00,1,21
global.css,6,css,e90e88d5,AHayslip23,11/18/2025,0:16:39,-08:00,2025-11-18T00:16:39-08:00,1,71
global.css,7,css,e90e88d5,AHayslip23,11/18/2025,0:16:39,-08:00,2025-11-18T00:16:39-08:00,2,34
global.css,8,css,e90e88d5,AHayslip23,11/18/2025,0:16:39,-08:00,2025-11-18T00:16:39-08:00,0,0
global.css,9,css,e90e88d5,AHayslip23,11/18/2025,0:16:39,-08:00,2025-11-18T00:16:39-08:00,0,0
global.css,10,css,e90e88d5,AHayslip23,11/18/2025,0:16:39,-08:00,2025-11-18T00:16:39-08:00,0,19
global.css,11,css,e90e88d5,AHayslip23,11/18/2025,0:16:39,-08:00,2025-11-18T00:16:39-08:00,0,12
global.css,12,css,e90e88d5,AHayslip23,11/18/2025,0:16:39,-08:00,2025-11-18T00:16:39-08:00,1,12
global.css,13,css,e90e88d5,AHayslip23,11/18/2025,0:16:39,-08:00,2025-11-18T00:16:39-08:00,1,18
global.css,14,css,e90e88d5,AHayslip23,11/18/2025,0:16:39,-08:00,2025-11-18T00:16:39-08:00,1,29
global.css,15,css,e90e88d5,AHayslip23,11/18/2025,0:16:39,-08:00,2025-11-18T00:16:39-08:00,1,10
global.css,16,css,e90e88d5,AHayslip23,11/18/2025,0:16:39,-08:00,2025-11-18T00:16:39-08:00,1,20
global.css,17,css,e90e88d5,AHayslip23,11/18/2025,0:16:39,-08:00,2025-11-18T00:16:39-08:00,0,0
global.css,18,css,e90e88d5,AHayslip23,11/18/2025,0:16:39,-08:00,2025-11-18T00:16:39-08:00,0,0
global.css,19,css,e90e88d5,AHayslip23,11/18/2025,0:16:39,-08:00,2025-11-18T00:16:39-08:00,0,15
global.css,20,css,e90e88d5,AHayslip23,11/18/2025,0:16:39,-08:00,2025-11-18T00:16:39-08:00,1,6
global.css,21,css,e90e88d5,AHayslip23,11/18/2025,0:16:39,-08:00,2025-11-18T00:16:39-08:00,1,12
global.css,22,css,e90e88d5,AHayslip23,11/18/2025,0:16:39,-08:00,2025-11-18T00:16:39-08:00,1,18
global.css,23,css,e90e88d5,AHayslip23,11/18/2025,0:16:39,-08:00,2025-11-18T00:16:39-08:00,1,11
global.css,24,css,e90e88d5,AHayslip23,11/18/2025,0:16:39,-08:00,2025-11-18T00:16:39-08:00,1,16
global.css,25,css,e90e88d5,AHayslip23,11/18/2025,0:16:39,-08:00,2025-11-18T00:16:39-08:00,0,0
global.css,26,css,e90e88d5,AHayslip23,11/18/2025,0:16:39,-08:00,2025-11-18T00:16:39-08:00,0,0
global.css,27,css,e90e88d5,AHayslip23,11/18/2025,0:16:39,-08:00,2025-11-18T00:16:39-08:00,0,13
global.css,28,css,e90e88d5,AHayslip23,11/18/2025,0:16:39,-08:00,2025-11-18T00:16:39-08:00,1,6
global.css,29,css,e90e88d5,AHayslip23,11/18/2025,0:16:39,-08:00,2025-11-18T00:16:39-08:00,0,0
global.css,30,css,e90e88d5,AHayslip23,11/18/2025,0:16:39,-08:00,2025-11-18T00:16:39-08:00,0,0
global.css,31,css,e90e88d5,AHayslip23,11/18/2025,0:16:39,-08:00,2025-11-18T00:16:39-08:00,0,11
global.css,32,css,e90e88d5,AHayslip23,11/18/2025,0:16:39,-08:00,2025-11-18T00:16:39-08:00,1,17
global.css,33,css,e90e88d5,AHayslip23,11/18/2025,0:16:39,-08:00,2025-11-18T00:16:39-08:00,1,10
global.css,34,css,e90e88d5,AHayslip23,11/18/2025,0:16:39,-08:00,2025-11-18T00:16:39-08:00,1,18
global.css,35,css,e90e88d5,AHayslip23,11/18/2025,0:16:39,-08:00,2025-11-18T00:16:39-08:00,0,0
global.css,36,css,e90e88d5,AHayslip23,11/18/2025,0:16:39,-08:00,2025-11-18T00:16:39-08:00,0,0
global.css,37,css,e90e88d5,AHayslip23,11/18/2025,0:16:39,-08:00,2025-11-18T00:16:39-08:00,0,19
global.css,38,css,e90e88d5,AHayslip23,11/18/2025,0:16:39,-08:00,2025-11-18T00:16:39-08:00,0,14
global.css,39,css,e90e88d5,AHayslip23,11/18/2025,0:16:39,-08:00,2025-11-18T00:16:39-08:00,1,21
global.css,40,css,e90e88d5,AHayslip23,11/18/2025,0:16:39,-08:00,2025-11-18T00:16:39-08:00,0,0
global.css,41,css,e90e88d5,AHayslip23,11/18/2025,0:16:39,-08:00,2025-11-18T00:16:39-08:00,0,0
global.css,42,css,e90e88d5,AHayslip23,11/18/2025,0:16:39,-08:00,2025-11-18T00:16:39-08:00,0,10
global.css,43,css,e90e88d5,AHayslip23,11/18/2025,0:16:39,-08:00,2025-11-18T00:16:39-08:00,1,8
global.css,44,css,e90e88d5,AHayslip23,11/18/2025,0:16:39,-08:00,2025-11-18T00:16:39-08:00,1,9
global.css,45,css,e90e88d5,AHayslip23,11/18/2025,0:16:39,-08:00,2025-11-18T00:16:39-08:00,0,0
global.css,46,css,e90e88d5,AHayslip23,11/18/2025,0:16:39,-08:00,2025-11-18T00:16:39-08:00,0,0
global.css,47,css,e90e88d5,AHayslip23,11/18/2025,0:16:39,-08:00,2025-11-18T00:16:39-08:00,0,9
global.css,48,css,e90e88d5,AHayslip23,11/18/2025,0:16:39,-08:00,2025-11-18T00:16:39-08:00,1,12
global.css,49,css,e90e88d5,AHayslip23,11/18/2025,0:16:39,-08:00,2025-11-18T00:16:39-08:00,1,42
global.css,50,css,e90e88d5,AHayslip23,11/18/2025,0:16:39,-08:00,2025-11-18T00:16:39-08:00,1,17
global.css,51,css,e90e88d5,AHayslip23,11/18/2025,0:16:39,-08:00,2025-11-18T00:16:39-08:00,1,15
global.css,52,css,e90e88d5,AHayslip23,11/18/2025,0:16:39,-08:00,2025-11-18T00:16:39-08:00,1,21
global.css,53,css,e90e88d5,AHayslip23,11/18/2025,0:16:39,-08:00,2025-11-18T00:16:39-08:00,0,0
global.css,54,css,e90e88d5,AHayslip23,11/18/2025,0:16:39,-08:00,2025-11-18T00:16:39-08:00,0,0
global.css,55,css,e90e88d5,AHayslip23,11/18/2025,0:16:39,-08:00,2025-11-18T00:16:39-08:00,0,10
global.css,56,css,e90e88d5,AHayslip23,11/18/2025,0:16:39,-08:00,2025-11-18T00:16:39-08:00,1,16
global.css,57,css,e90e88d5,AHayslip23,11/18/2025,0:16:39,-08:00,2025-11-18T00:16:39-08:00,0,0
global.css,58,css,e90e88d5,AHayslip23,11/18/2025,0:16:39,-08:00,2025-11-18T00:16:39-08:00,0,0
global.css,59,css,e90e88d5,AHayslip23,11/18/2025,0:16:39,-08:00,2025-11-18T00:16:39-08:00,0,11
global.css,60,css,e90e88d5,AHayslip23,11/18/2025,0:16:39,-08:00,2025-11-18T00:16:39-08:00,1,16
global.css,61,css,e90e88d5,AHayslip23,11/18/2025,0:16:39,-08:00,2025-11-18T00:16:39-08:00,1,10
global.css,62,css,e90e88d5,AHayslip23,11/18/2025,0:16:39,-08:00,2025-11-18T00:16:39-08:00,0,0
global.css,63,css,e90e88d5,AHayslip23,11/18/2025,0:16:39,-08:00,2025-11-18T00:16:39-08:00,0,0
global.css,64,css,e90e88d5,AHayslip23,11/18/2025,0:16:39,-08:00,2025-11-18T00:16:39-08:00,0,10
global.css,65,css,e90e88d5,AHayslip23,11/18/2025,0:16:39,-08:00,2025-11-18T00:16:39-08:00,1,17
global.css,66,css,e90e88d5,AHayslip23,11/18/2025,0:16:39,-08:00,2025-11-18T00:16:39-08:00,1,18
global.css,67,css,e90e88d5,AHayslip23,11/18/2025,0:16:39,-08:00,2025-11-18T00:16:39-08:00,0,0
global.css,68,css,e90e88d5,AHayslip23,11/18/2025,0:16:39,-08:00,2025-11-18T00:16:39-08:00,0,0
global.css,69,css,e90e88d5,AHayslip23,11/18/2025,0:16:39,-08:00,2025-11-18T00:16:39-08:00,0,9
global.css,70,css,e90e88d5,AHayslip23,11/18/2025,0:16:39,-08:00,2025-11-18T00:16:39-08:00,1,9
global.css,71,css,e90e88d5,AHayslip23,11/18/2025,0:16:39,-08:00,2025-11-18T00:16:39-08:00,1,10
global.css,72,css,e90e88d5,AHayslip23,11/18/2025,0:16:39,-08:00,2025-11-18T00:16:39-08:00,1,19
global.css,73,css,e90e88d5,AHayslip23,11/18/2025,0:16:39,-08:00,2025-11-18T00:16:39-08:00,1,20
global.css,74,css,e90e88d5,AHayslip23,11/18/2025,0:16:39,-08:00,2025-11-18T00:16:39-08:00,1,16
global.css,75,css,e90e88d5,AHayslip23,11/18/2025,0:16:39,-08:00,2025-11-18T00:16:39-08:00,1,39
global.css,76,css,e90e88d5,AHayslip23,11/18/2025,0:16:39,-08:00,2025-11-18T00:16:39-08:00,0,0
global.css,77,css,e90e88d5,AHayslip23,11/18/2025,0:16:39,-08:00,2025-11-18T00:16:39-08:00,0,0
global.css,78,css,e90e88d5,AHayslip23,11/18/2025,0:16:39,-08:00,2025-11-18T00:16:39-08:00,0,13
global.css,79,css,e90e88d5,AHayslip23,11/18/2025,0:16:39,-08:00,2025-11-18T00:16:39-08:00,0,14
global.css,80,css,e90e88d5,AHayslip23,11/18/2025,0:16:39,-08:00,2025-11-18T00:16:39-08:00,1,12
global.css,81,css,e90e88d5,AHayslip23,11/18/2025,0:16:39,-08:00,2025-11-18T00:16:39-08:00,1,47
global.css,82,css,e90e88d5,AHayslip23,11/18/2025,0:16:39,-08:00,2025-11-18T00:16:39-08:00,1,8
global.css,83,css,e90e88d5,AHayslip23,11/18/2025,0:16:39,-08:00,2025-11-18T00:16:39-08:00,1,20
global.css,84,css,e90e88d5,AHayslip23,11/18/2025,0:16:39,-08:00,2025-11-18T00:16:39-08:00,1,28
global.css,85,css,e90e88d5,AHayslip23,11/18/2025,0:16:39,-08:00,2025-11-18T00:16:39-08:00,1,16
global.css,86,css,e90e88d5,AHayslip23,11/18/2025,0:16:39,-08:00,2025-11-18T00:16:39-08:00,0,0
global.css,87,css,e90e88d5,AHayslip23,11/18/2025,0:16:39,-08:00,2025-11-18T00:16:39-08:00,0,0
global.css,88,css,e90e88d5,AHayslip23,11/18/2025,0:16:39,-08:00,2025-11-18T00:16:39-08:00,0,11
global.css,89,css,e90e88d5,AHayslip23,11/18/2025,0:16:39,-08:00,2025-11-18T00:16:39-08:00,1,16
global.css,90,css,e90e88d5,AHayslip23,11/18/2025,0:16:39,-08:00,2025-11-18T00:16:39-08:00,1,21
global.css,91,css,e90e88d5,AHayslip23,11/18/2025,0:16:39,-08:00,2025-11-18T00:16:39-08:00,1,24
global.css,92,css,e90e88d5,AHayslip23,11/18/2025,0:16:39,-08:00,2025-11-18T00:16:39-08:00,1,13
global.css,93,css,e90e88d5,AHayslip23,11/18/2025,0:16:39,-08:00,2025-11-18T00:16:39-08:00,0,0
global.css,94,css,e90e88d5,AHayslip23,11/18/2025,0:16:39,-08:00,2025-11-18T00:16:39-08:00,0,0
global.css,95,css,e90e88d5,AHayslip23,11/18/2025,0:16:39,-08:00,2025-11-18T00:16:39-08:00,0,11
global.css,96,css,e90e88d5,AHayslip23,11/18/2025,0:16:39,-08:00,2025-11-18T00:16:39-08:00,1,14
global.css,97,css,e90e88d5,AHayslip23,11/18/2025,0:16:39,-08:00,2025-11-18T00:16:39-08:00,1,15
global.css,98,css,e90e88d5,AHayslip23,11/18/2025,0:16:39,-08:00,2025-11-18T00:16:39-08:00,1,18
global.css,99,css,e90e88d5,AHayslip23,11/18/2025,0:16:39,-08:00,2025-11-18T00:16:39-08:00,0,0
global.css,100,css,e90e88d5,AHayslip23,11/18/2025,0:16:39,-08:00,2025-11-18T00:16:39-08:00,0,0
global.css,101,css,e90e88d5,AHayslip23,11/18/2025,0:16:39,-08:00,2025-11-18T00:16:39-08:00,0,21
global.css,102,css,e90e88d5,AHayslip23,11/18/2025,0:16:39,-08:00,2025-11-18T00:16:39-08:00,0,16
global.css,103,css,e90e88d5,AHayslip23,11/18/2025,0:16:39,-08:00,2025-11-18T00:16:39-08:00,1,16
global.css,104,css,e90e88d5,AHayslip23,11/18/2025,0:16:39,-08:00,2025-11-18T00:16:39-08:00,1,21
global.css,105,css,e90e88d5,AHayslip23,11/18/2025,0:16:39,-08:00,2025-11-18T00:16:39-08:00,0,0
global.css,106,css,e90e88d5,AHayslip23,11/18/2025,0:16:39,-08:00,2025-11-18T00:16:39-08:00,0,0
global.css,107,css,e90e88d5,AHayslip23,11/18/2025,0:16:39,-08:00,2025-11-18T00:16:39-08:00,0,28
global.css,108,css,e90e88d5,AHayslip23,11/18/2025,0:16:39,-08:00,2025-11-18T00:16:39-08:00,0,16
global.css,109,css,e90e88d5,AHayslip23,11/18/2025,0:16:39,-08:00,2025-11-18T00:16:39-08:00,1,16
global.css,110,css,e90e88d5,AHayslip23,11/18/2025,0:16:39,-08:00,2025-11-18T00:16:39-08:00,1,12
global.css,111,css,e90e88d5,AHayslip23,11/18/2025,0:16:39,-08:00,2025-11-18T00:16:39-08:00,0,0
global.css,112,css,e90e88d5,AHayslip23,11/18/2025,0:16:39,-08:00,2025-11-18T00:16:39-08:00,0,0
global.css,113,css,e90e88d5,AHayslip23,11/18/2025,0:16:39,-08:00,2025-11-18T00:16:39-08:00,0,21
global.css,114,css,e90e88d5,AHayslip23,11/18/2025,0:16:39,-08:00,2025-11-18T00:16:39-08:00,0,22
global.css,115,css,e90e88d5,AHayslip23,11/18/2025,0:16:39,-08:00,2025-11-18T00:16:39-08:00,1,14
global.css,116,css,e90e88d5,AHayslip23,11/18/2025,0:16:39,-08:00,2025-11-18T00:16:39-08:00,0,0
global.css,117,css,e90e88d5,AHayslip23,11/18/2025,0:16:39,-08:00,2025-11-18T00:16:39-08:00,0,0
global.css,118,css,e90e88d5,AHayslip23,11/18/2025,0:16:39,-08:00,2025-11-18T00:16:39-08:00,0,21
global.css,119,css,e90e88d5,AHayslip23,11/18/2025,0:16:39,-08:00,2025-11-18T00:16:39-08:00,1,11
global.css,120,css,e90e88d5,AHayslip23,11/18/2025,0:16:39,-08:00,2025-11-18T00:16:39-08:00,0,0
global.css,121,css,e90e88d5,AHayslip23,11/18/2025,0:16:39,-08:00,2025-11-18T00:16:39-08:00,0,0
global.css,122,css,e90e88d5,AHayslip23,11/18/2025,0:16:39,-08:00,2025-11-18T00:16:39-08:00,0,0
global.css,123,css,e90e88d5,AHayslip23,11/18/2025,0:16:39,-08:00,2025-11-18T00:16:39-08:00,0,0
global.css,124,css,e90e88d5,AHayslip23,11/18/2025,0:16:39,-08:00,2025-11-18T00:16:39-08:00,0,0
global.css,125,css,e90e88d5,AHayslip23,11/18/2025,0:16:39,-08:00,2025-11-18T00:16:39-08:00,0,0
global.css,126,css,e90e88d5,AHayslip23,11/18/2025,0:16:39,-08:00,2025-11-18T00:16:39-08:00,0,0
global.css,127,css,e90e88d5,AHayslip23,11/18/2025,0:16:39,-08:00,2025-11-18T00:16:39-08:00,0,0
global.css,128,css,e90e88d5,AHayslip23,11/18/2025,0:16:39,-08:00,2025-11-18T00:16:39-08:00,0,0
global.css,129,css,e90e88d5,AHayslip23,11/18/2025,0:16:39,-08:00,2025-11-18T00:16:39-08:00,0,0
global.css,130,css,e90e88d5,AHayslip23,11/18/2025,0:16:39,-08:00,2025-11-18T00:16:39-08:00,0,0
global.css,131,css,e90e88d5,AHayslip23,11/18/2025,0:16:39,-08:00,2025-11-18T00:16:39-08:00,0,0
global.css,132,css,e90e88d5,AHayslip23,11/18/2025,0:16:39,-08:00,2025-11-18T00:16:39-08:00,0,0
global.css,133,css,e90e88d5,AHayslip23,11/18/2025,0:16:39,-08:00,2025-11-18T00:16:39-08:00,0,0
global.css,134,css,e90e88d5,AHayslip23,11/18/2025,0:16:39,-08:00,2025-11-18T00:16:39-08:00,0,0
resume\index.html,1,html,a35e105e,AHayslip23,9/30/2025,22:22:18,-07:00,2025-09-30T22:22:18-07:00,0,14
resume\index.html,2,html,a35e105e,AHayslip23,9/30/2025,22:22:18,-07:00,2025-09-30T22:22:18-07:00,0,4
resume\index.html,3,html,a35e105e,AHayslip23,9/30/2025,22:22:18,-07:00,2025-09-30T22:22:18-07:00,2,20
resume\index.html,4,html,a35e105e,AHayslip23,9/30/2025,22:22:18,-07:00,2025-09-30T22:22:18-07:00,2,68
resume\index.html,5,html,a35e105e,AHayslip23,9/30/2025,22:22:18,-07:00,2025-09-30T22:22:18-07:00,2,54
resume\index.html,6,html,452be9c2,AHayslip23,10/3/2025,22:11:56,-07:00,2025-10-03T22:11:56-07:00,2,42
resume\index.html,7,html,a35e105e,AHayslip23,9/30/2025,22:22:18,-07:00,2025-09-30T22:22:18-07:00,0,5
resume\index.html,8,html,a35e105e,AHayslip23,9/30/2025,22:22:18,-07:00,2025-09-30T22:22:18-07:00,0,4
resume\index.html,9,html,a35e105e,AHayslip23,9/30/2025,22:22:18,-07:00,2025-09-30T22:22:18-07:00,0,0
resume\index.html,10,html,70d8f4c6,AHayslip23,9/30/2025,22:36:33,-07:00,2025-09-30T22:36:33-07:00,1,13
resume\index.html,11,html,a35e105e,AHayslip23,9/30/2025,22:22:18,-07:00,2025-09-30T22:22:18-07:00,0,0
resume\index.html,12,html,a35e105e,AHayslip23,9/30/2025,22:22:18,-07:00,2025-09-30T22:22:18-07:00,1,7
resume\index.html,13,html,a35e105e,AHayslip23,9/30/2025,22:22:18,-07:00,2025-09-30T22:22:18-07:00,2,26
resume\index.html,14,html,a35e105e,AHayslip23,9/30/2025,22:22:18,-07:00,2025-09-30T22:22:18-07:00,2,17
resume\index.html,15,html,a35e105e,AHayslip23,9/30/2025,22:22:18,-07:00,2025-09-30T22:22:18-07:00,2,80
resume\index.html,16,html,a35e105e,AHayslip23,9/30/2025,22:22:18,-07:00,2025-09-30T22:22:18-07:00,2,28
resume\index.html,17,html,a35e105e,AHayslip23,9/30/2025,22:22:18,-07:00,2025-09-30T22:22:18-07:00,1,8
resume\index.html,18,html,a35e105e,AHayslip23,9/30/2025,22:22:18,-07:00,2025-09-30T22:22:18-07:00,0,0
resume\index.html,19,html,a35e105e,AHayslip23,9/30/2025,22:22:18,-07:00,2025-09-30T22:22:18-07:00,1,22
resume\index.html,20,html,a35e105e,AHayslip23,9/30/2025,22:22:18,-07:00,2025-09-30T22:22:18-07:00,1,7
resume\index.html,21,html,4109f81a,AHayslip23,10/4/2025,15:13:39,-07:00,2025-10-04T15:13:39-07:00,2,22
resume\index.html,22,html,a35e105e,AHayslip23,9/30/2025,22:22:18,-07:00,2025-09-30T22:22:18-07:00,2,7
resume\index.html,23,html,a35e105e,AHayslip23,9/30/2025,22:22:18,-07:00,2025-09-30T22:22:18-07:00,3,6
resume\index.html,24,html,4109f81a,AHayslip23,10/4/2025,15:13:39,-07:00,2025-10-04T15:13:39-07:00,4,64
resume\index.html,25,html,a35e105e,AHayslip23,9/30/2025,22:22:18,-07:00,2025-09-30T22:22:18-07:00,3,7
resume\index.html,26,html,4109f81a,AHayslip23,10/4/2025,15:13:39,-07:00,2025-10-04T15:13:39-07:00,3,59
resume\index.html,27,html,a35e105e,AHayslip23,9/30/2025,22:22:18,-07:00,2025-09-30T22:22:18-07:00,3,2
resume\index.html,28,html,a35e105e,AHayslip23,9/30/2025,22:22:18,-07:00,2025-09-30T22:22:18-07:00,4,122
resume\index.html,29,html,a35e105e,AHayslip23,9/30/2025,22:22:18,-07:00,2025-09-30T22:22:18-07:00,4,126
resume\index.html,30,html,a35e105e,AHayslip23,9/30/2025,22:22:18,-07:00,2025-09-30T22:22:18-07:00,4,112
resume\index.html,31,html,a35e105e,AHayslip23,9/30/2025,22:22:18,-07:00,2025-09-30T22:22:18-07:00,4,156
resume\index.html,32,html,a35e105e,AHayslip23,9/30/2025,22:22:18,-07:00,2025-09-30T22:22:18-07:00,3,3
resume\index.html,33,html,a35e105e,AHayslip23,9/30/2025,22:22:18,-07:00,2025-09-30T22:22:18-07:00,4,6
resume\index.html,34,html,4109f81a,AHayslip23,10/4/2025,15:13:39,-07:00,2025-10-04T15:13:39-07:00,4,74
resume\index.html,35,html,a35e105e,AHayslip23,9/30/2025,22:22:18,-07:00,2025-09-30T22:22:18-07:00,3,7
resume\index.html,36,html,a35e105e,AHayslip23,9/30/2025,22:22:18,-07:00,2025-09-30T22:22:18-07:00,3,92
resume\index.html,37,html,a35e105e,AHayslip23,9/30/2025,22:22:18,-07:00,2025-09-30T22:22:18-07:00,3,2
resume\index.html,38,html,a35e105e,AHayslip23,9/30/2025,22:22:18,-07:00,2025-09-30T22:22:18-07:00,4,109
resume\index.html,39,html,a35e105e,AHayslip23,9/30/2025,22:22:18,-07:00,2025-09-30T22:22:18-07:00,4,117
resume\index.html,40,html,4109f81a,AHayslip23,10/4/2025,15:13:39,-07:00,2025-10-04T15:13:39-07:00,4,114
resume\index.html,41,html,a35e105e,AHayslip23,9/30/2025,22:22:18,-07:00,2025-09-30T22:22:18-07:00,3,3
resume\index.html,42,html,a35e105e,AHayslip23,9/30/2025,22:22:18,-07:00,2025-09-30T22:22:18-07:00,2,8
resume\index.html,43,html,a35e105e,AHayslip23,9/30/2025,22:22:18,-07:00,2025-09-30T22:22:18-07:00,1,8
resume\index.html,44,html,a35e105e,AHayslip23,9/30/2025,22:22:18,-07:00,2025-09-30T22:22:18-07:00,0,0
resume\index.html,45,html,4109f81a,AHayslip23,10/4/2025,15:13:39,-07:00,2025-10-04T15:13:39-07:00,0,7
resume\index.html,46,html,4109f81a,AHayslip23,10/4/2025,15:13:39,-07:00,2025-10-04T15:13:39-07:00,2,27
resume\index.html,47,html,4109f81a,AHayslip23,10/4/2025,15:13:39,-07:00,2025-10-04T15:13:39-07:00,2,7
resume\index.html,48,html,4109f81a,AHayslip23,10/4/2025,15:13:39,-07:00,2025-10-04T15:13:39-07:00,3,6
resume\index.html,49,html,a6afb9e7,AHayslip23,10/4/2025,15:22:19,-07:00,2025-10-04T15:22:19-07:00,4,54
resume\index.html,50,html,4109f81a,AHayslip23,10/4/2025,15:13:39,-07:00,2025-10-04T15:13:39-07:00,3,7
resume\index.html,51,html,4109f81a,AHayslip23,10/4/2025,15:13:39,-07:00,2025-10-04T15:13:39-07:00,3,89
resume\index.html,52,html,4109f81a,AHayslip23,10/4/2025,15:13:39,-07:00,2025-10-04T15:13:39-07:00,3,2
resume\index.html,53,html,4109f81a,AHayslip23,10/4/2025,15:13:39,-07:00,2025-10-04T15:13:39-07:00,4,152
resume\index.html,54,html,4109f81a,AHayslip23,10/4/2025,15:13:39,-07:00,2025-10-04T15:13:39-07:00,4,110
resume\index.html,55,html,4109f81a,AHayslip23,10/4/2025,15:13:39,-07:00,2025-10-04T15:13:39-07:00,3,3
resume\index.html,56,html,4109f81a,AHayslip23,10/4/2025,15:13:39,-07:00,2025-10-04T15:13:39-07:00,2,8
resume\index.html,57,html,4109f81a,AHayslip23,10/4/2025,15:13:39,-07:00,2025-10-04T15:13:39-07:00,1,8
resume\index.html,58,html,4109f81a,AHayslip23,10/4/2025,15:13:39,-07:00,2025-10-04T15:13:39-07:00,0,0
resume\index.html,59,html,4109f81a,AHayslip23,10/4/2025,15:13:39,-07:00,2025-10-04T15:13:39-07:00,2,7
resume\index.html,60,html,4109f81a,AHayslip23,10/4/2025,15:13:39,-07:00,2025-10-04T15:13:39-07:00,2,16
resume\index.html,61,html,4109f81a,AHayslip23,10/4/2025,15:13:39,-07:00,2025-10-04T15:13:39-07:00,2,7
resume\index.html,62,html,4109f81a,AHayslip23,10/4/2025,15:13:39,-07:00,2025-10-04T15:13:39-07:00,3,6
resume\index.html,63,html,4109f81a,AHayslip23,10/4/2025,15:13:39,-07:00,2025-10-04T15:13:39-07:00,4,41
resume\index.html,64,html,4109f81a,AHayslip23,10/4/2025,15:13:39,-07:00,2025-10-04T15:13:39-07:00,4,28
resume\index.html,65,html,4109f81a,AHayslip23,10/4/2025,15:13:39,-07:00,2025-10-04T15:13:39-07:00,3,7
resume\index.html,66,html,4109f81a,AHayslip23,10/4/2025,15:13:39,-07:00,2025-10-04T15:13:39-07:00,3,61
resume\index.html,67,html,4109f81a,AHayslip23,10/4/2025,15:13:39,-07:00,2025-10-04T15:13:39-07:00,3,6
resume\index.html,68,html,4109f81a,AHayslip23,10/4/2025,15:13:39,-07:00,2025-10-04T15:13:39-07:00,4,47
resume\index.html,69,html,4109f81a,AHayslip23,10/4/2025,15:13:39,-07:00,2025-10-04T15:13:39-07:00,4,64
resume\index.html,70,html,4109f81a,AHayslip23,10/4/2025,15:13:39,-07:00,2025-10-04T15:13:39-07:00,3,7
resume\index.html,71,html,4109f81a,AHayslip23,10/4/2025,15:13:39,-07:00,2025-10-04T15:13:39-07:00,3,88
resume\index.html,72,html,4109f81a,AHayslip23,10/4/2025,15:13:39,-07:00,2025-10-04T15:13:39-07:00,2,8
resume\index.html,73,html,4109f81a,AHayslip23,10/4/2025,15:13:39,-07:00,2025-10-04T15:13:39-07:00,1,8
resume\index.html,74,html,4109f81a,AHayslip23,10/4/2025,15:13:39,-07:00,2025-10-04T15:13:39-07:00,0,0
resume\index.html,75,html,a35e105e,AHayslip23,9/30/2025,22:22:18,-07:00,2025-09-30T22:22:18-07:00,1,13
resume\index.html,76,html,a35e105e,AHayslip23,9/30/2025,22:22:18,-07:00,2025-09-30T22:22:18-07:00,1,7
resume\index.html,77,html,a35e105e,AHayslip23,9/30/2025,22:22:18,-07:00,2025-09-30T22:22:18-07:00,2,13
resume\index.html,78,html,a35e105e,AHayslip23,9/30/2025,22:22:18,-07:00,2025-09-30T22:22:18-07:00,2,2
resume\index.html,79,html,70d8f4c6,AHayslip23,9/30/2025,22:36:33,-07:00,2025-09-30T22:36:33-07:00,3,64
resume\index.html,80,html,567acc34,AHayslip23,9/30/2025,22:31:17,-07:00,2025-09-30T22:31:17-07:00,3,47
resume\index.html,81,html,70d8f4c6,AHayslip23,9/30/2025,22:36:33,-07:00,2025-09-30T22:36:33-07:00,3,58
resume\index.html,82,html,70d8f4c6,AHayslip23,9/30/2025,22:36:33,-07:00,2025-09-30T22:36:33-07:00,3,49
resume\index.html,83,html,70d8f4c6,AHayslip23,9/30/2025,22:36:33,-07:00,2025-09-30T22:36:33-07:00,3,15
resume\index.html,84,html,a35e105e,AHayslip23,9/30/2025,22:22:18,-07:00,2025-09-30T22:22:18-07:00,2,3
resume\index.html,85,html,a35e105e,AHayslip23,9/30/2025,22:22:18,-07:00,2025-09-30T22:22:18-07:00,1,8
resume\index.html,86,html,41a7d35d,AHayslip23,10/14/2025,19:00:22,-07:00,2025-10-14T19:00:22-07:00,0,0
resume\index.html,87,html,41a7d35d,AHayslip23,10/14/2025,19:00:22,-07:00,2025-10-14T19:00:22-07:00,1,48
resume\index.html,88,html,a35e105e,AHayslip23,9/30/2025,22:22:18,-07:00,2025-09-30T22:22:18-07:00,0,5
resume\index.html,89,html,a35e105e,AHayslip23,9/30/2025,22:22:18,-07:00,2025-09-30T22:22:18-07:00,0,5
projects\projects.js,1,js,e3796581,AHayslip23,10/18/2025,17:34:25,-07:00,2025-10-18T17:34:25-07:00,0,55
projects\projects.js,2,js,a22e5e1a,AHayslip23,10/29/2025,21:05:05,-07:00,2025-10-29T21:05:05-07:00,0,63
projects\projects.js,3,js,e3796581,AHayslip23,10/18/2025,17:34:25,-07:00,2025-10-18T17:34:25-07:00,0,0
projects\projects.js,4,js,342b5101,AHayslip23,10/29/2025,20:35:58,-07:00,2025-10-29T20:35:58-07:00,0,16
projects\projects.js,5,js,342b5101,AHayslip23,10/29/2025,20:35:58,-07:00,2025-10-29T20:35:58-07:00,0,13
projects\projects.js,6,js,342b5101,AHayslip23,10/29/2025,20:35:58,-07:00,2025-10-29T20:35:58-07:00,0,14
projects\projects.js,7,js,342b5101,AHayslip23,10/29/2025,20:35:58,-07:00,2025-10-29T20:35:58-07:00,0,20
projects\projects.js,8,js,342b5101,AHayslip23,10/29/2025,20:35:58,-07:00,2025-10-29T20:35:58-07:00,0,16
projects\projects.js,9,js,e16262b4,AHayslip23,10/29/2025,20:52:10,-07:00,2025-10-29T20:52:10-07:00,0,21
projects\projects.js,10,js,c0aff02a,AHayslip23,10/29/2025,21:12:52,-07:00,2025-10-29T21:12:52-07:00,0,22
projects\projects.js,11,js,c0aff02a,AHayslip23,10/29/2025,21:12:52,-07:00,2025-10-29T21:12:52-07:00,0,8
projects\projects.js,12,js,342b5101,AHayslip23,10/29/2025,20:35:58,-07:00,2025-10-29T20:35:58-07:00,0,0
projects\projects.js,13,js,e3796581,AHayslip23,10/18/2025,17:34:25,-07:00,2025-10-18T17:34:25-07:00,0,29
projects\projects.js,14,js,d95c1c6e,AHayslip23,10/18/2025,18:19:23,-07:00,2025-10-18T18:19:23-07:00,1,3
projects\projects.js,15,js,342b5101,AHayslip23,10/29/2025,20:35:58,-07:00,2025-10-29T20:35:58-07:00,2,49
projects\projects.js,16,js,342b5101,AHayslip23,10/29/2025,20:35:58,-07:00,2025-10-29T20:35:58-07:00,2,54
projects\projects.js,17,js,342b5101,AHayslip23,10/29/2025,20:35:58,-07:00,2025-10-29T20:35:58-07:00,2,56
projects\projects.js,18,js,d95c1c6e,AHayslip23,10/18/2025,18:19:23,-07:00,2025-10-18T18:19:23-07:00,0,0
projects\projects.js,19,js,d95c1c6e,AHayslip23,10/18/2025,18:19:23,-07:00,2025-10-18T18:19:23-07:00,2,48
projects\projects.js,20,js,a22e5e1a,AHayslip23,10/29/2025,21:05:05,-07:00,2025-10-29T21:05:05-07:00,2,75
projects\projects.js,21,js,fe3fa3b4,AHayslip23,10/28/2025,22:01:04,-07:00,2025-10-28T22:01:04-07:00,0,0
projects\projects.js,22,js,c0aff02a,AHayslip23,10/29/2025,21:12:52,-07:00,2025-10-29T21:12:52-07:00,2,21
projects\projects.js,23,js,d95c1c6e,AHayslip23,10/18/2025,18:19:23,-07:00,2025-10-18T18:19:23-07:00,1,15
projects\projects.js,24,js,d95c1c6e,AHayslip23,10/18/2025,18:19:23,-07:00,2025-10-18T18:19:23-07:00,2,46
projects\projects.js,25,js,d95c1c6e,AHayslip23,10/18/2025,18:19:23,-07:00,2025-10-18T18:19:23-07:00,1,0
projects\projects.js,26,js,e3796581,AHayslip23,10/18/2025,17:34:25,-07:00,2025-10-18T17:34:25-07:00,0,0
projects\projects.js,27,js,e3796581,AHayslip23,10/18/2025,17:34:25,-07:00,2025-10-18T17:34:25-07:00,0,0
projects\projects.js,28,js,e3796581,AHayslip23,10/18/2025,17:34:25,-07:00,2025-10-18T17:34:25-07:00,0,13
projects\projects.js,29,js,e3796581,AHayslip23,10/18/2025,17:34:25,-07:00,2025-10-18T17:34:25-07:00,0,0
projects\projects.js,30,js,342b5101,AHayslip23,10/29/2025,20:35:58,-07:00,2025-10-29T20:35:58-07:00,0,49
projects\projects.js,31,js,ed83389c,AHayslip23,10/29/2025,20:27:55,-07:00,2025-10-29T20:27:55-07:00,0,48
projects\projects.js,32,js,a22e5e1a,AHayslip23,10/29/2025,21:05:05,-07:00,2025-10-29T21:05:05-07:00,1,39
projects\projects.js,33,js,a22e5e1a,AHayslip23,10/29/2025,21:05:05,-07:00,2025-10-29T21:05:05-07:00,1,19
projects\projects.js,34,js,a22e5e1a,AHayslip23,10/29/2025,21:05:05,-07:00,2025-10-29T21:05:05-07:00,0,1
projects\projects.js,35,js,ed83389c,AHayslip23,10/29/2025,20:27:55,-07:00,2025-10-29T20:27:55-07:00,0,0
projects\projects.js,36,js,a22e5e1a,AHayslip23,10/29/2025,21:05:05,-07:00,2025-10-29T21:05:05-07:00,0,29
projects\projects.js,37,js,a22e5e1a,AHayslip23,10/29/2025,21:05:05,-07:00,2025-10-29T21:05:05-07:00,1,43
projects\projects.js,38,js,a22e5e1a,AHayslip23,10/29/2025,21:05:05,-07:00,2025-10-29T21:05:05-07:00,2,55
projects\projects.js,39,js,a22e5e1a,AHayslip23,10/29/2025,21:05:05,-07:00,2025-10-29T21:05:05-07:00,1,0
projects\projects.js,40,js,ed83389c,AHayslip23,10/29/2025,20:27:55,-07:00,2025-10-29T20:27:55-07:00,0,0
projects\projects.js,41,js,a22e5e1a,AHayslip23,10/29/2025,21:05:05,-07:00,2025-10-29T21:05:05-07:00,1,66
projects\projects.js,42,js,a22e5e1a,AHayslip23,10/29/2025,21:05:05,-07:00,2025-10-29T21:05:05-07:00,2,53
projects\projects.js,43,js,a22e5e1a,AHayslip23,10/29/2025,21:05:05,-07:00,2025-10-29T21:05:05-07:00,2,73
projects\projects.js,44,js,a22e5e1a,AHayslip23,10/29/2025,21:05:05,-07:00,2025-10-29T21:05:05-07:00,1,0
projects\projects.js,45,js,a22e5e1a,AHayslip23,10/29/2025,21:05:05,-07:00,2025-10-29T21:05:05-07:00,0,0
projects\projects.js,46,js,a22e5e1a,AHayslip23,10/29/2025,21:05:05,-07:00,2025-10-29T21:05:05-07:00,1,56
projects\projects.js,47,js,c0aff02a,AHayslip23,10/29/2025,21:12:52,-07:00,2025-10-29T21:12:52-07:00,1,21
projects\projects.js,48,js,a22e5e1a,AHayslip23,10/29/2025,21:05:05,-07:00,2025-10-29T21:05:05-07:00,0,0
projects\projects.js,49,js,a22e5e1a,AHayslip23,10/29/2025,21:05:05,-07:00,2025-10-29T21:05:05-07:00,0,0
projects\projects.js,50,js,a22e5e1a,AHayslip23,10/29/2025,21:05:05,-07:00,2025-10-29T21:05:05-07:00,0,36
projects\projects.js,51,js,fe3fa3b4,AHayslip23,10/28/2025,22:01:04,-07:00,2025-10-28T22:01:04-07:00,1,42
